Candidate,Party,Type,Date,Title,Speech
Bobby Jindal,R,p,"July 18, 2015",Press Release - Bobby Jindal Gets Largest Ovation at the Family Leadership Summit,"Governor Jindal received a huge reception this afternoon at the Family Leader Summit today in Iowa. There were multiple standing ovations for the Governor.Jindal is receiving the loudest and longest applause of the night so far. #FLS2015 Linh Ta (@linhmaita) July 18, 2015Biggest cheer of the day comes for Jindal's attack on... the media. ""They don't apply the same standards"" to Obama as ""the rest of us."" Reid J. Epstein (@reidepstein) July 18, 2015Maybe loudest applause of the day when Bobby Jindal accuses press of failing to criticize Barack Obama as much as it criticizes Republicans Jason Noble (@jasonnobleDMR) July 18, 2015Jindal has probably now gotten more standing ovations at Family Leader in Iowa than any other candidate Ben Jacobs (@Bencjacobs) July 18, 2015Here is some reaction on twitter about the big reception the Governor received today:Call from the crowd ""Go Bobby Go,"" as Jindal takes stage Ben Jacobs (@Bencjacobs) July 18, 2015.@BobbyJindal railing on Supreme Court. Several people stand and cheer. #FLS2015 pic.twitter.com/xjPABDTeHF Dave Price (@idaveprice) July 18, 2015Bobby Jindal brings the room to its feet at #FLS2015 Ben Jacobs (@Bencjacobs) July 18, 2015Family Leader crowd loves Bobby Jindal. This is the most excitement I've seen him generate. Steve Peoples (@sppeoples) July 18, 2015We have a standing O for Jindal, talking about religious liberty. #FLS2015 Annah Backstrom (@AnnahBackstrom) July 18, 2015Crowd in Ames is as fired up for Bobby Jindal's religious freedom riffs as its been for anyone so far today. Reid J. Epstein (@reidepstein) July 18, 2015""America did not create religious liberty, religious liberty created the US"" Jindal gets standing ovation #FLS2015 Aaron Hepker (@ahepker) July 18, 2015. @BobbyJindal with standing ovation calling for ""bureaucrats"" to go to jail in wake of IRS targeting Benjy Sarlin (@BenjySarlin) July 18, 2015@BobbyJindal touching on guns, EPA, religion, political scandals, and more. Audience loves it. #FLS2015 #iacaucus pic.twitter.com/BUQvLOP48H Sarah Beckman (@SarahBeckman3) July 18, 2015More religious liberty defense, more standing ovation for @BobbyJindal #FLS2015 Dave Price (@idaveprice) July 18, 2015Bobby Jindal now getting huge cheers for saying media has pro-Obama bias. The room gets LOUD Ben Jacobs (@Bencjacobs) July 18, 2015Standing O Jindal calling out the press. #FLS2015 Longest sustained applause of the day. Annah Backstrom (@AnnahBackstrom) July 18, 2015Frank Luntz asks Jindal to address the press, he says we don't apply same standards to Obama as others, and now gigantic standing ovation Benjy Sarlin (@BenjySarlin) July 18, 2015Jindal rips common core, EPA, IRS, then giant standing O when ripping the press for not applying same standard to Obama as others #FLS2015 Todd Erzen (@DeaceOnline) July 18, 2015Jindal gets his fourth standing ovation and longest of the day for criticizing media coverage of President Obama. #gop2016 #fls2015 Matthew DeFour (@WSJMattD4) July 18, 2015Losing count now, but @BobbyJindal may have passed @tedcruz in number of standing ovations from crowd. #FLS2015 Dave Price (@idaveprice) July 18, 2015Another big standing ovation for Jindal as he leaves stage. Crowd stays on its feet as he stops to wave Ben Jacobs (@Bencjacobs) July 18, 2015Jindal receives standing ovation as he leaves the stage #FLS2015 pic.twitter.com/ordBSZvgax Aaron Hepker (@ahepker) July 18, 2015Twitter limits video to 30 seconds. This ovation for @BobbyJindal went on for longer. #FLS2015 pic.twitter.com/zkjA8c4yWf Supriya Jindal (@SupriyaJindal) July 18, 2015Bobby Jindal brings the room to its feet at #FLS2015 Ben Jacobs (@Bencjacobs) July 18, 2015Bobby Jindal knocked it out of the ballpark! #FLS2015 Jodi Girard (@MamaGirard) July 18, 2015Glad I came across #FLS2015 tonight. Listening to @BobbyJindal now. #IWantMyCountryBack #IStandWithIsrael Hummus & Hebrews (@FigTreeBlessing) July 18, 2015""I never knew you were that good."" -Frank Luntz on Bobby Jindal #FLS2015 Blyle (@blyle) July 18, 2015Jindal exits and is new leader of standing ovation caucus #FLS2015 Todd Erzen (@DeaceOnline) July 18, 2015"
Bobby Jindal,R,p,"July 20, 2015",Press Release - New Poll: Jindal Rising in Iowa,"A new poll out this morning from Monmouth University shows big movement for Governor Jindal in Iowa.Based on public polling data, Governor Jindal has had the largest improvement in favorables (+10) and 3rd largest improvement in net favorables (+7). Further, compared to Quinnapiac polling, Governor Jindal has had the 3rd largest improvement on first choice ballot (+1), 2nd largest improvement on second choice ballot, and 2nd largest improvement on combined ballot."
Bobby Jindal,R,p,"July 20, 2015",Press Release - Jindal Wins the Weekend in Iowa,
Bobby Jindal,R,p,"July 21, 2015",Press Release - The Iran Deal: A New Low for Hashtag Diplomacy,".@POTUS has taken hashtag diplomacy to a new low. @TheIranDeal is a bad deal for America. A Twitter account can't change that simple fact. Gov. Bobby Jindal (@BobbyJindal) July 21, 2015.@TheIranDeal, how come this deal doesn't allow us to inspect Iran's military facilities... except when they have time to hide everything? Gov. Bobby Jindal (@BobbyJindal) July 21, 2015.@TheIranDeal, why does Iranian Government still chant death to America? Gov. Bobby Jindal (@BobbyJindal) July 21, 2015.@TheIranDeal, why didn't you force Iran to free American hostages? Gov. Bobby Jindal (@BobbyJindal) July 21, 2015.@TheIranDeal, why did you make a deal with United Nations before the US Congress? Shows us where your priorities are. Gov. Bobby Jindal (@BobbyJindal) July 21, 2015.@TheIranDeal, why do you keep trying appeasement? It never works, and it's shameful that you are even trying it. Gov. Bobby Jindal (@BobbyJindal) July 21, 2015"
Bobby Jindal,R,p,"July 22, 2015",Press Release - Why Do So Many People Think Hillary Clinton Isn't Honest?,A new poll finds 59% of Iowans distrust Hillary Clinton. Why do you think that is?
Bobby Jindal,R,p,"July 22, 2015",Press Release - Fire the Director of U.S. Citizenship and Immigration Services,"Becoming a United States citizen is not a right, it is a privilege. Immigration without assimilation is not immigration, it is invasion. Legal immigration by people who vow to defend the United States of America can make us stronger, and my own family is evidence of this."" -Bobby JindalThe Obama Administration has announced that they are planning to alter the Oath of Allegiance for people who are becoming American citizens by deleting the requirement that they be willing to bear arms on behalf of the United States or perform noncombat service in the Armed Forces of the United States of America.I am calling on the President to fire Leon Rodriguez, the director of U.S. Citizenship and Immigration Services, today."
Bobby Jindal,R,p,"July 22, 2015",Press Release - Op-Ed: It's Time to Stop Pretending on Radical Islam,"Op-Ed by Gov. Bobby Jindal in Conservative ReviewLet's be honest here. The President's inability to say the words Radical Islam is threatening our national security and the safety of the American people. It's time to stop pretending.Radical Islam has brought terror and death across the Middle East and the worldand on American soil  yet this president calls it just ""violent extremism"" or something similar. He gets it wrong nearly every time.Yesterday, Britain's Prime Minister David Cameron got it right. He had the courage to say what President Obama will not, when he said that, ""We need to confront and expose Islamist extremism as a belief system that glorifies violence and subjugates people."" This leaves President Obama as pretty much the only leader in the free world who refuses to speak the truth about Radical Islam.Our President's political correctness and fear of speaking the truth are no longer amusing, they are just plain dangerous, because you cannot defeat an enemy you refuse to name.President Obama cannot claim to be working with our allies when he refuses to join them in naming our common enemy. He has proven himself incapable as Commander-in-Chief.This is one case where President Obama should lead from behind  he should follow the lead of our British ally, name the enemy and resolve to destroy Radical Islam.Defeating Radical Islam can be done and must be done. It will take American leadership and military strength, and it will take leadership from Muslim leaders as well as the West. Right now, we have neither.This is one case where President Obama should lead from behind  he should follow the lead of our British ally, name the enemy and resolve to destroy Radical Islam.We also must strengthen our immigration policy. If people want to come to America in order to use our freedoms to undermine our freedoms  we have the absolute right to say no thanks. This should be obvious to everyone and is basic common sense.If you claim that you want to carry out these attacks because of your so-called religion, that's ridiculous and we don't have an obligation to honor your request. There are many American citizens who are Muslim and who believe in America, and they are tremendous.But let's not pretend that there are not many people in the world today who are Radical Islamists  who use their religion to justify savage violence and treating women like property.We should not let people like that immigrate to our country, we would be fools to do that. And only a lemming would fail to see that Europe has a terrible problem in this regard.They have too many immigrants who do not want to assimilate into their culture, but instead want to establish their own culture and laws in direct opposition. That is just fact, and everyone knows it, and I will not be intimidated on this.We have no idea how many people are being wooed by Radical Islam, with the sick and deceitful promise of glory in the afterlife if they will murder innocent people.Frankly, our President needs to be honest about it and take action to protect our people. That's his job.He must also call on Islamic leaders to do more than simply condemn violence. We have no idea how many people are being wooed by Radical Islam, with the sick and deceitful promise of glory in the afterlife if they will murder innocent people. Muslim leaders must make clear that anyone who commits acts of terror in the name of Islam is in fact not a martyr who will enjoy a reward in the afterlife, but rather is going straight to Hell. If they refuse to say this, then they are condoning these acts of barbarism. There is no middle ground.Islamic leaders must put a stop to this, and it's not too much to ask.But President Obama has failed to demand this of Islamic leaders. Instead, he hides behind political correctness. He's afraid of calling a spade a spade, but it's simply stating the truth. And the reality is that Radical Muslim leaders benefit from this free pass. They can continue wooing followers with the siren song of a new caliphate and glorious afterlife. This must come to an end.One of the great things about America is it doesn't matter if you've been here five minutes or a hundred years. For the most part, folks that come here want to be Americans. They understand and value that America offers an opportunity at a better life. They join our military, they start companies, and they work to create a better community. That is the American Dream.What's not acceptable is people that want to come and conquer us. These immigrants want to come here and change our fundamental culture and values and set up their own. That's not immigration, it's invasion.Of course, the politically correct crowd will call you a racist for saying things like that. But it's reality. This is the particular threat we face. And if we're not serious about this, we're going to see more lone-wolf actors.Europe has learned this lesson the hard way. They have not assimilated many of their immigrant populations and the result is that there are pockets of immigrant communities that never really ""get"" what the country they've moved to is all about. That is not America. In America, we are all Americans because being American is about a set of values: hard work, freedom, and opportunity.But the first step to fixing this problem is identifying it. We first have to call Radical Islam what it isevil. I hope the President steps up, does the right thing and helps us defeat Radical Islam once and for all."
Bobby Jindal,R,p,"July 23, 2015",Press Release - Momentum Continues to Build for Jindal in Iowa,"Over the past several weeks, Governor Jindal has hit the ground running in Iowa, launching a 99 county tour that has not only granted extensive exposure for the Governor but has produced a plethora of positive earned media.A poll fielded from July 19th through July 21st among 600 Iowa Republican Caucus attendees show the extent to which Governor Jindal's ramped up efforts in Iowa are not only boosting his image ratings but are directly translating to the ballot.While the image ratings of other Republican hopefuls have stagnated or retreated, Governor Jindal continues to grow his positives and currently sits at an impressive 70-10 favorable rating among Iowa GOP Caucus participants.More often than not, ballot follows image which is exactly what we see on the ballot test as Jindal finds himself in 4th place overall at 8%"
Bobby Jindal,R,p,"July 28, 2015",Press Release - Demand These Companies Stop Funding Planned Parenthood,38 large companies are helping to fund Planned Parenthood. Demand they stop.
Bobby Jindal,R,p,"July 31, 2015",Press Release - New Iowa Poll Shows Continued Jindal Momentum,"A new Iowa poll from Gravis has Governor Jindal currently in 4th place. Looking at the most recent Iowa polls, one thing is clear: Iowa voters like what they have been hearing from Governor Jindal. "
Bobby Jindal,R,p,"August 1, 2015",Press Release - Stop Planned Parenthood,"After four horrifying videos, an Obama appointed judge has blocked the release of new ones. Rather than address the trafficking of baby organs, Planned Parenthood has tried to censor citizens from further exposing the truth about their organization. Planned Parenthood must be stopped."
Bobby Jindal,R,p,"August 4, 2015",Press Release - Bobby Jindal at Voters First Forum,
Bobby Jindal,R,p,"August 6, 2015",Press Release - Social Media Reaction to #GOPDebate,"We saw plenty of smooth talking and famous names running for President, but only one candidate in the race has the backbone, the bandwidth and the experience to get the job done as President  Governor Jindal.Fiorina & Jindal did well and could be on the big stage. I don't think anyone else made that case. Stephen Hayes (@stephenfhayes) August 6, 2015Again, Jindal impresses. Brian Wilson (@BrianWilsonDC) August 6, 2015Best performance I've ever seen from Jindal. Crisp. Brian Wilson (@BrianWilsonDC) August 6, 2015Governor Jindal on the war on terror: ""We are going to take the political handcuffs off the military."" #GOPDebate Don Teague (@DonTeagueFox26) August 6, 2015Both @CarlyFiorina and @BobbyJindal did very very well. Countdown to candidates dropping out shd begin tmrw. Laura Ingraham (@IngrahamAngle) August 6, 2015Jindal might have had the best day 1 answer. Noah Rothman (@NoahCRothman) August 6, 2015""Sometimes you win a war by killing murderous, evil terrorists."" Gov. Bobby Jindal #GOPDebate Jon Scott (@JonScottFNC) August 6, 2015Rankings: 1. Carly 2. Jindal. None of the rest matter. Chris Cillizza (@TheFix) August 6, 2015Jindal did the most with the least. https://t.co/R1X93ViKJU Chris Cillizza (@TheFix) August 6, 2015Jindal forcefully criticizing Pres Obama for not calling out ""radical Islamic terrorism."" #GOPDebate T.J. Holmes (@tjholmes) August 6, 2015Outperforming so far: Fiorina, Jindal \nUnderperforming: Perry Taegan Goddard (@politicalwire) August 6, 2015Really liked Jindal's Medicaid answer. Specific and substantive. I'm...skeptical that Pataki would've passed on expansion. #GOPDebate Guy Benson (@guypbenson) August 6, 2015Usual, Jindal substantive. Stuart Rothenberg (@StuPolitics) August 6, 2015"
Bobby Jindal,R,p,"August 6, 2015",Press Release - Bobby Jindal at the #GOPDebate in Cleveland,"Governor Jindal's most popular lines from the debate:On Medicaid expansion and the danger of owing so much debt to China:""This isn't free money. I know some people like to say, 'well, this is free money.'... We are borrowing money from China today ... the President stunningly admitted this: He said, 'We don't have leverage with China to get a better deal on Iran because we need them to lend us money to continue operating our government.' The president of the United States admitting that he's weakening our government's position, our foreign policy standing, because he can't control spending in D.C.""On immigration:""We must insist on assimilation  immigration without assimilation is an invasion. We need to tell folks who want to come here, they need to come here legally. They need to learn English, adopt our values, roll up their sleeves and get to work.""On Planned Parenthood:""Planned Parenthood had better hope that Hillary Clinton wins this election, because I guarantee under President Jindal, January 2017, the Department of Justice and the IRS and everybody else that we can send from the federal government will be going in to Planned Parenthood. This is absolutely disgusting, and revolts the conscience of the nation.""Read the social media reaction here."
Bobby Jindal,R,p,"August 7, 2015",Press Release - Republicans & Democrats Uniting Against the Iran Deal,"I will vote to disapprove the agreement, not because I believe war is a viable or desirable option, nor to challenge the path of diplomacy. It is because I believe Iran will not change, and under this agreement it will be able to achieve its dual goals of eliminating sanctions while ultimately retaining its nuclear and non-nuclear power. Better to keep U.S. sanctions in place, strengthen them, enforce secondary sanctions on other nations, and pursue the hard-trodden path of diplomacy once more, difficult as it may be."" -Chuck Schumer"
Bobby Jindal,R,p,"August 7, 2015",Press Release - Social Media Reaction to Bobby Jindal at #RSG15,"According to those in the crowd, Gov. Jindal drew the largest applause of the day.Loudest longest standing ovation at #RSG15 thus far goes to @BobbyJindal, it appears Ryan Lovelace (@LovelaceRyanD) August 7, 2015Standing ovation for @BobbyJindal at #RedState Kelly O'Donnell (@KellyO) August 7, 2015Standing ovation for this at RedState from Bobby Jindal: ""U.S. did not create religious liberty. Religious liberty created the U.S. #RSG15 Paula Bolyard (@pbolyard) August 7, 2015Jindal is giving his usual stump speech here at #RSG15 and it's getting a very good reception Ben Jacobs (@Bencjacobs) August 7, 2015Jindal gets standing O from #RSG15 crowd. Well received  a couple big lines. #gapol Daniel Malloy (@ajconwashington) August 7, 2015Based on the livestream at least, the @RedState crowd seems to be very responsive to @BobbyJindal's speech. Lots of applause and interaction Elizabeth Crisp (@elizabethcrisp) August 7, 2015Gov Bobby Jindal at #RSG15, getting a great reception. pic.twitter.com/r7at356MHE Ed Morrissey (@EdMorrissey) August 7, 2015Jindal: ""we need to insist on assimilation and integration,"" to applause. ""immigration without assimilation is invasion."" Katie Glueck (@katie_glueck) August 7, 2015Big standing O for @BobbyJindal ""The USA did not create religious liberty. Religious liberty created the USA."" #gapol #RSG15 Daniel Malloy (@ajconwashington) August 7, 2015Gov. Jindal had the best boots too.. @BobbyJindal wins best boots so far at #rsg15 (until of course I bust mine out Saturday) pic.twitter.com/nnADIHAk4a Katie Pavlich (@KatiePavlich) August 7, 2015@BobbyJindal street cred just skyrocketed @EdMorrissey\nFor Salena Zito: Jindal's boots. #RSG15 pic.twitter.com/6eLonEFekR SalenaZito (@SalenaZitoTrib) August 7, 2015Gov. Jindal took a selfie using the Twitter Mirror..@BobbyJindal is in the house at #RSG15. Signing his Twitter Mirror selfie with @EWErickson. pic.twitter.com/gPpOSBYY9M Andrew Carroll (@randrewcarroll) August 7, 2015"
Bobby Jindal,R,p,"August 10, 2015",Press Release - The Only Candidate to Actually Cut Spending: Bobby Jindal,"The Cato Institute released a study that showed Gov. Jindal is the only candidate running for president who can claim he actually reduced the size of government. This is further proof that while other candidates enjoy talking a big game about spending cuts, Gov. Jindal is the only candidate who has actually done it."
Bobby Jindal,R,p,"August 11, 2015","Press Release - Governor Jindal Blasts Democrats In Marion, Iowa",
Bobby Jindal,R,p,"August 13, 2015",Press Release - Hillary's Wishlist,"Tips on Deleting Emails From Email Book Hillary Clinton Wanted to Read"" ABC NewsAccording to ABC News, Hillary Clinton emailed a staffer to request a book titled ""Send: Why People Email So Badly and How to Do It Better"" that includes chapters ""The Email That Can Land You In Jail"" and ""How to Delete Something So It Stays Deleted.""Here are some other books we suspect are on Hillary's wishlist:"
Bobby Jindal,R,p,"August 17, 2015",Press Release - Iowa Speaker Pro Tem Matt Windschitl Endorses Bobby Jindal for President,"His ability to govern in tough economic times is well demonstrated. As are his abilities to balance a budget and work with folks from all walks of life to get the job done. He has demonstrated bold leadership on many issues, including taking steps to defund the abortion industry in light of recent revelations about the sale of body parts."" State Rep. Matt Windschitl, R-Missouri Valley"
Bobby Jindal,R,p,"August 20, 2015","Press Release - Tell Hillary Clinton They're Called Babies Not ""Specimens"" or ""Fetal Tissue""",
Bobby Jindal,R,p,"August 21, 2015",Press Release - Planned Parenthood Protests Governor Jindal,"Yesterday, Planned Parenthood held a protest outside the Louisiana Governor's Mansion because of Governor Jindal's decision to cancel Louisiana's Medicaid contract with Planned Parenthood. Governor Jindal played the Planned Parenthood videos on his front lawn so protestors could see why he made the decision he did."
Bobby Jindal,R,p,"August 21, 2015",Press Release - One of These Health Care Plans is Not Like the Others,
