Candidate,Party,Type,Date,Title,Speech
Hillary Clinton ,D,s,"January 18, 2008",Statement from Senator Clinton on President Bush's Economic Stimulus Plan,"Press reports this morning indicate that President Bush is finally releasing an economic stimulus plan. Unfortunately, the Bush plan shortchanges the 50 million Americans who most need an economic shot in the arm. ""I have been calling for bipartisan action on stimulus for over a month and last week laid out a detailed plan to help struggling families and boost our economy. While I believe my plan is the strongest approach, the need for stimulus is urgent and we need a bipartisan package that is temporary and targets those who need help the most. ""For the White House to propose spending over $100 billion to jumpstart the economy, while shortchanging assistance to the 50 million families who are struggling the most and are most likely to inject those funds into the economy makes no sense. The Bush approach would fail to fully help the millions of lower income senior citizens who live on fixed incomes and are under enormous financial stress. And it would disproportionately leave out African American and Hispanic families who have, on average, lower incomes than white families. ""I hope President Bush will work with Democrats to design an economic stimulus plan that includes temporary tax relief focused on both jumpstarting our economy and fully supporting our most hard-pressed working families. I also urge the Administration to address the concerns I raised in my plan, including help for those struggling to find new jobs, keep their health care, and pay rising energy bills. And it's vital to recognize that without aggressive action to stabilize the housing crises, no plan will be fully effective for struggling families and communities across this nation."""
Hillary Clinton ,D,s,"January 24, 2008",Statement from Hillary Clinton Regarding Today's Agreement on Economic Stimulus,"I am heartened to see that Speaker Pelosi and the Bush Administration have reached an agreement on stimulus that would extend immediate tax rebates to more than 100 million hardworking Americans, including 35 million families who would have been left out under the Administration's initial proposal. I have been calling for extending tax rebates to these lower-income Americans, and will push to ensure that these families receive the full assistance that they need. ""In addition to fast-acting rebates for hardworking families, I believe that we need immediate measures to address the most pressing challenges our working families are facing in this economic downturn. We need a comprehensive approach to combating the housing crisis, which is dragging down our economy and threatening to foreclose the American Dream for millions of families. We need to expand and extend unemployment insurance to help those who are struggling to find a job. And we need to provide immediate relief from skyrocketing energy bills. I look forward to working with Leader Reid, Chairman Baucus and my Senate colleagues on a fast-acting, comprehensive stimulus package in the days and weeks ahead."""
Hillary Clinton ,D,s,"January 25, 2008",Statement by Senator Hillary Clinton on the Seating of Delegates at the Democratic National Convention,"I hear all the time from people in Florida and Michigan that they want their voices heard in selecting the Democratic nominee. ""I believe our nominee will need the enthusiastic support of Democrats in these states to win the general election, and so I will ask my Democratic convention delegates to support seating the delegations from Florida and Michigan. I know not all of my delegates will do so and I fully respect that decision. But I hope to be President of all 50 states and U.S. territories, and that we have all 50 states represented and counted at the Democratic convention. ""I hope my fellow potential nominees will join me in this. ""I will of course be following the no-campaigning pledge that I signed, and expect others will as well."""
Hillary Clinton ,D,s,"January 26, 2008",Statement from Hillary Clinton,"I have called Senator Obama to congratulate him and wish him well. ""Thank you to the people of South Carolina who voted today and welcomed me into their homes over the last year. Your stories will stay with me well beyond this campaign and I am grateful for the support so many of you gave to me. ""We now turn our attention to the millions of Americans who will make their voices heard in Florida and the twenty-two states as well as American Samoa who will vote on February 5th. ""In the days ahead, I'll work to give voice to those who are working harder than ever to be heard. For those who have lost their job or their home or their health care, I will focus on the solutions needed to move this country forward. That's what this election is about. It's about our country, our hopes and dreams. Our families and our future."""
Hillary Clinton ,D,s,"January 28, 2008",Statement from Senator Hillary Clinton on Ukrainian Membership in NATO,"I enthusiastically welcome the January 11 letter from Ukrainian President Viktor Yushchenko, Prime Minister Yuliya Tymoshenko, and Verkhovna Rada Chairman Arsenii Yatsenyuk to NATO Secretary General Jaap de Hoop Scheffer, which outlines Ukraine's desire for a closer relationship with NATO, including a Membership Action Plan. Like Ukraine's leaders, I hope that important steps toward reaching these goals will be made at the NATO summit in Bucharest in early April. I applaud the fact that Ukraine aspires to anchor itself firmly in the trans-Atlantic community through membership in NATO and look forward to working with Ukrainians and Ukrainian-Americans to reach that goal. Since the earliest days of Ukrainian independence, the strategy of the United States has always been to respect and support the Ukrainian people's democratic choices in shaping their future. Ukraine has been and remains an extremely important partner for the United States, and I take great pride in Ukraine's contributions to our common goal of building a Europe that is whole and free, peaceful and prosperous. When I traveled to Ukraine in 1997, I visited a memorial to the victims of Communist repression in Lviv, and made a commitment to the Ukrainian people on behalf of the United States: ""In your fight for freedom, your fight for democracy, the American people will stand with you."" In recalling that commitment more than ten years later I applaud the immense contributions that Ukrainian-Americans have made to our country and the indispensable role they have played in broadening and deepening the bonds between the United States and Ukraine. I have been greatly impressed by the courage of the Ukrainian people as they emerged from decades of Soviet oppression and as they have experienced both victories and struggles on the path to democracy and freedom. I have worked for more than 15 years to strengthen the U.S.-Ukraine relationship and help improve the lives of Ukrainians. Even before my first visit to Kyiv in 1995, I supported health care programs for Ukraine, including partnerships between hospitals in the United States and Ukraine and airlifts of critical pharmaceuticals and other medical supplies. After hearing pleas from Ukrainian women in 1997 to help combat human trafficking, which had become a growing problem in Ukraine, I helped initiate an international effort to combat trafficking, including several programs specifically to help Ukraine. In 1996, I organized a 10th anniversary White House commemoration of the Chornobyl disaster and, as honorary chair of Chornobyl Challenge '96, committed to continuing support for humanitarian efforts on behalf of those who suffer severe health consequences from the tragedy. I was honored to receive the Children of Chornobyl's Relief Fund Lifetime Humanitarian Achievement Award in 1999 for my work in helping to improve the health of women and children in Ukraine. As Senator I traveled to Ukraine in 2005 and met with President Yushchenko and offered the U.S. government's support for reform efforts to strengthen Ukraine's democracy. The United States has always favored the closest possible ties between NATO and Ukraine, including the creation of the NATO-Ukraine Council. We have always insisted on an open door policy for European democracies that want to join the Alliance. The enlargement of NATO is not directed against any state; NATO does not see any nation as its enemy. I pledge to support Ukraine's efforts to meet the criteria for MAP and eventual membership. The United States should actively encourage our NATO Allies to deepen their own ties with Ukraine, a country that has broken with an authoritarian past and pursues good relations with all its neighbors. Ukraine deserves a chance to pursue its aspirations for a wider role in the Euro-Atlantic community. In the same spirit, I call on the Bush Administration to give Ukraine all the support it needs to complete its accession to the World Trade Organization. As President, I will ensure that the United States does everything necessary to help Ukraine realize these important and achievable goals."
Hillary Clinton ,D,s,"January 28, 2008",Hillary Clinton Statement on the Fall in Home Sales,"Tonight President Bush will claim that the state of our union is strong. But as the latest housing data shows, the true state of the union is one of economic anxiety. ""The latest housing data shows that 2007 marked the first time in recent history where America has experienced a sustained annual drop in median existing home prices. In fact, according to some economists, America hasn't experienced a sustained annual decline in housing prices of this magnitude since the Great Depression. ""This dramatic decline in home sales is sending ripples across the economy. Construction-related employment is weakening and families' finances are increasingly strained. In order for us to truly jumpstart our Economy, we must address the housing crisis. ""Simply put, in order to bring our nation's financial house in order, we need to begin with housing itself. That is why my economic stimulus plan calls for $30 billion in assistance to states and communities to help them fight foreclosures. I have also called for a 90-day moratorium on subprime foreclosures and a five-year freeze in rates on subprime adjustable mortgages."""
Hillary Clinton ,D,s,"January 28, 2008",Hillary Clinton Statement on the State of the Union,"Tonight President Bush claimed that the state of our union is strong. And we can all debate that. But what is not up for debate is that for too many American families, the true ""state of their lives"" is one of economic anxiety and uncertainty. As I've traveled across the country and visited with people in their homes, I have listened to the urgent problems they face. These families are resolute, and when it comes to their strength, optimism and hard work, the state of our union has never been stronger. Yet after seven years of stagnant wages, declining incomes and increasing inequality, our families are working harder and harder and still falling behind. President Bush had one final chance tonight to acknowledge what the American people have known for years: that the economy is not working for middle class families. Unfortunately, what he offered was more of the same - a frustrating commitment to the same failed policies that helped turn record surpluses into large deficits, and push a thriving twenty-first century economy to the brink of recession. We need a President who understands the urgent economic challenges our families face and who will work as hard for middle-class families as they work for America. I intend to be that President for the American people. While I was heartened to hear the President acknowledge the need for immediate actions to jumpstart our economy, it will take more than tax rebates to fix our economic crisis and rebuild our economy for the future. We need immediate relief for people who are losing their jobs and facing skyrocketing home heating costs. And we need a comprehensive solution to the housing crisis. Every housing proposal the President made tonight, I made several months - and hundreds of thousands of foreclosure notices - ago. For example, I have proposed to enable the Federal Housing Administration to function as an alternative to the subprime market; and I have proposed to empower state housing finance agencies to help families refinance unworkable mortgages. But more is needed. So I have also called on the mortgage industry to observe a 90-day foreclosure moratorium on subprime mortgages and a 5-year freeze in rates on subprime loans. We need a long-term economic vision to restore shared growth and prosperity for America's middle class. As President, I will work every day to create good high-paying jobs that can't be outsourced, restore fairness to our economy, renew the promise of America that if you work hard, you can get ahead, and restore real fiscal responsibility to Washington. In Iraq, President Bush talked about the success of the surge. The Administration brandishes many numbers. The one I'm most focused on is that 2007 was the deadliest year for U.S. troops in Iraq. And the humanitarian situation remains devastating. President Bush isn't satisfied with failure after failure in Iraq; he wants to bind the next President to his failed strategy by unilaterally negotiating with the Iraqi government about the future of the U.S.-Iraq security relationship, including the possibility of permanent U.S. bases in Iraq. The Bush Administration says it does not even plan to submit this agreement to the Congress for approval, even though Iraqi officials plan to submit it to their parliament. It is an outrage that the Iraqi parliament will have an opportunity to debate this but the American Congress won't. We need to rein in this President. That is why I introduced the first legislation to require the President to submit any such agreement for congressional approval and to withhold any funding to carry out the agreement. After seven long years of this Presidency, I am committed as President to solve problems, not ignore them. I am committed to working for the middle class, not just the privileged few. I am committed to restoring our leadership in the world through strong alliances, not alienating our friends. I am committed to working towards real solutions for real Americans every day as President of the United States."
Hillary Clinton ,D,s,"January 29, 2008",Hillary Clinton Statement on the Fall in Home Prices,"The respected Case-Shiller Index shows that home prices fell 7.7% in November 2007 from November 2006. The dramatic decline means that families have lost an estimated $1.6 trillion in household wealth. The loss of household wealth is compromising the financial security of millions of families and it is sending ripples through the economy as consumers cut back their spending. Today's housing data is further evidence that the state of the union is a state of economic anxiety for too many families. The data underscore the need for a solution to the foreclosure crisis that is contributing to the weakness in home prices. Data was also released today showing that 2.2 million foreclosure notices were sent out last year, a 75% increase from 2006. We cannot jumpstart the economy without addressing the foreclosure crisis. That is why my stimulus plan calls for $30 billion in assistance to states and communities to help them fight foreclosures. I have also called for a 90-day moratorium on subprime foreclosures and a 5-year freeze in rates on subprime adjustable mortgages."
Hillary Clinton ,D,s,"January 30, 2008",Statement from Hillary Clinton,John Edwards ended his campaign today in the same way he started it - by standing with the people who are too often left behind and nearly always left out of our national debate. John ran with compassion and conviction and lifted this campaign with his deep concern for the daily lives of the American people. That is what this election is about - it's about our people. And John is one of the greatest champions the American people could ask for. I wish John and Elizabeth all the best. They have my great personal respect and gratitude. And I know they will continue to fight passionately for the country and the people they love so deeply.
Hillary Clinton ,D,s,"January 30, 2008",Hillary Clinton Statement on the Fourth Quarter 2007 GDP Report,"Today's news that our economy grew at an anemic 0.6% in the fourth quarter of 2007 reinforces my fear that we are sliding into a recession. This data confirms that for far too many families, the state of the union is a state of economic anxiety. I have been calling since early December for Congress and the President to take immediate action to jumpstart our economy. I am heartened to see that the House moved quickly to pass a stimulus package. But we need more than tax rebates and business incentives to fix our ailing economy. That is why I have called for extending unemployment insurance for those who are looking for work, expanding heating assistance for those facing skyrocketing heating cost, and enacting a comprehensive solution to the housing crisis, including a 90-day foreclosure moratorium and a 5-year interest rate freeze on subprime mortgages."
Hillary Clinton ,D,s,"January 30, 2008",Hillary Clinton's Statement on the FBI's Inquiry into the Mortgage Industry,"For a long time families and community groups have been saying that the subprime mortgage industry was rife with abuses. A federal investigation of industry practices is long overdue. Last year, I introduced the Home Ownership Preservation Act to curb industry abuses by registering mortgage brokers, eliminating certain lending practices, and providing $100 million in assistance to states to investigate and prosecute mortgage-related fraud. But we must not only end the abusive practices, we must end the foreclosure crisis itself. That is why I have also proposed a 90-day moratorium on subprime foreclosures, a 5-year freeze in rates on subprime adjustable rate mortgages, and $30 billion in assistance to states and communities to fight foreclosures and offset the costs associated with mounting vacancies."""
Hillary Clinton ,D,s,"January 31, 2008",Hillary Clinton Statement on Her New Legislation to Fight Foreclosures,"Today I introduced the Mortgage Refinancing Initiative Act, legislation that will enable state housing finance agencies to help tens of thousands of families refinance unworkable mortgages and avoid foreclosures. This is a policy I proposed last October, and which President Bush called for three months and several hundred thousand foreclosure notices later. ""The legislation I introduced today will temporarily modify the Mortgage Revenue Bond program to allow state housing agencies to use the proceeds of tax-exempt bond issuances to facilitate mortgage refinancings. State housing agencies will be able to commit up to $10 billion over two years to refinancing unworkable mortgages. States will high foreclosure rates will receive the greatest assistance. ""For nearly a year I have called for action on the foreclosure crisis that is devastating communities, shaking our economy, and putting the financial security of millions of families at risk. 1.3 million households received foreclosure notices last year. Mounting foreclosures are adding to the weakness in house prices, and therefore even families not at risk of losing their homes are affected. The decline in home prices has already cost families an estimated $1.6 trillion. We cannot jumpstart our economy without tackling the foreclosure crisis. ""In addition to today's legislation, I have a comprehensive plan to address the foreclosure crisis. Specifically, I have proposed a 90-day moratorium on subprime foreclosures, a 5-year freeze in rates on subprime adjustable rate mortgages, and $30 billion in assistance to states and communities to fight foreclosures and offset the costs associated with mounting vacancies."" Leaders and Experts Comment on Hillary's Legislation and Plan to Fight Foreclosures ""For nearly a year now, Senator Clinton has been calling attention to the foreclosure crisis and proposing bold ways of addressing it. The legislation she introduced today is a sensible and cost-effective way of cutting foreclosures. In addition, I believe that her call for a 90-day moratorium on subprime foreclosures, a 5-year freeze in rates on subprime loans, and a $30 billion fund to help states fight foreclosures, is the right approach for tackling the mortgage crisis."" -- Jon Corzine, Governor of New Jersey ""A natural outcome of your bill is that more individuals and families would be able to stay in their homes without the threat of foreclosure. Refinancing existing loans to more affordable rates and prices that are based on current market information will be a boon to families that face very high interests rates -- and very high payments -- on existing adjustable mortgages."" -- Richard F. Gaylord, President, National Association of Realtors"
Hillary Clinton ,D,s,"February 1, 2008",Hillary Clinton Statement on January Employment Report,"Today's report that our economy actually lost jobs in January confirms my view that we are sliding into a second Bush recession. During the same month that President Bush declared that the state of our union was strong, the economy lost 17,000 jobs, the worst jobs performance in four and a half years. This data shows what so many of the families I meet every day already know: this economy is failing middle class families. Washington must act immediately and aggressively to head off our growing economic crisis. This report underscores why it is absolutely critical that we include in any stimulus package extended unemployment insurance for those who are losing their jobs and looking work in our ailing economy. And while I am heartened to see that the House moved quickly to pass a stimulus package, we need more than tax rebates and business incentives to fix our ailing economy. That is why I have called for expanding heating assistance for those facing skyrocketing heating cost, and enacting a comprehensive solution to the housing crisis, including a 90-day foreclosure moratorium and a 5-year interest rate freeze on subprime mortgages."
Hillary Clinton ,D,s,"February 1, 2008",Statement by Senator Clinton on Black History Month,February is Black History Month and a time when we honor the significant contributions that African-Americans have made to the American culture and way of life. We reflect and pay special tribute to the courageous men and women who through their action and steadfastness opened doors paving the way for future generations. They were true American trailblazers and their efforts made an indelible mark on our great country. Black history is American history and should be celebrated today and every day that we as Americans enjoy the freedoms and the liberties that make us who we are.
Hillary Clinton ,D,s,"February 4, 2008",Hillary Clinton Statement on the President's Budget,"The only real significance of the President's budget is to serve as a legacy of his disastrous fiscal management over the last seven years. Once again we've seen the President's failed priorities laid bare in a budget that preserves every cent of his tax cuts for the wealthiest while placing the burden of his failures on the backs of working families, senior citizens, our police, our firefighters, our teachers and others. Instead of budgeting a long term AMT fix to provide tax relief for the middle class, addressing our long term energy needs or prioritizing sensible health care reforms, this budget's biggest contribution is a commitment to more deficits and even more debt financed by countries like China. Instead of addressing the needs of low income families and working poor, the President has proposed cutting home heating assistance in the middle of winter by 22 percent, cutting rural health care programs by 86 percent and the deepest cuts, and completely eliminating a critical early education program, Even Start. It has been seven years since this President squandered the opportunities of the surpluses created during the Clinton Administration, and it is past time to restore responsible fiscal management and put the priorities of middle class Americans first."
