Candidate,Party,Type,Date,Title,Speech
Hillary Clinton ,D,s,"April 18, 2008",Statement by Hillary Clinton on Georgia and Ukraine,"I am deeply disturbed by the latest Russian actions regarding Georgia, and Russia's broader policies towards its neighbors. Several weeks ago I called on NATO to extend a Membership Action Plan (MAP) to Georgia and Ukraine at the Bucharest Summit. I emphasized that this move would be a litmus test for the success of President Bush's leadership of the trans-Atlantic community. My support for MAP was based on the need to send a positive signal to Tbilisi and Kyiv to encourage them to stay on track with their positive reforms as well as to send a signal of our concern to Moscow about the future security of these countries. I deeply regret President Bush's inability to convince our NATO allies to take this action. This is the first time in memory a U.S. President has traveled to a NATO summit and failed to achieve his publicly proclaimed goals. Now the Russian government has taken advantage of the lack of unity coming out of the Bucharest Summit to further ratchet up the pressure on young democracies on its borders. Moscow's actions this week to strengthen ties with the separatist regions of Abkhazia and South Ossetia undermine the territorial integrity of the state of Georgia and are clearly designed to destabilize the government of President Mikheil Saakashvili. Georgia is a small democratic state in a turbulent region. It must not be allowed to be undermined. Two weeks ago President Bush sat with President Putin in Sochi just a few kilometers away from the Georgian border. He prided himself on his close working relationship with Vladimir Putin. President Bush should call on the Russian leadership to immediately rescind these steps. I also call on President Bush to immediately send a senior representative to Tbilisi to show our support for the government of Georgia. The United States should raise this matter in the United Nations Security Council, in a special 26+1 session of NATO's North Atlantic Council (NAC), and in the NATO-Russia Council. Russia needs to hear a unified message from the United States and our European partners about our shared commitment to Georgia's security and territorial integrity. These are not the only Russian moves that I have found troubling. Senior Russian officials have engaged in a pressure campaign to prevent Ukraine from seeking deeper ties with NATO. President Putin even raised the prospect of retargeting nuclear missiles against Ukraine. I am not advocating, nor do I envisage, a return to a new Cold War with Russia, which I believe ought to remain in the G-8, where the United States and its allies can together address our growing list of concerns with Moscow. But the current Administration's mishandling of Russian relations has contributed to Moscow's belief that it can do as it pleases. America and its allies can and must do better."
Hillary Clinton ,D,s,"April 18, 2008",Statement By Hillary Clinton On Passover,"As Jewish families across the world prepare to gather together around the Seder table, I am delighted to offer greetings and good wishes for a joyous Passover. I have always been inspired by the enduring words of the Haggadah: ""In every generation, each of us must see ourselves as if we personally came out of Egypt."" It's through remembering the past that we become strong and effective advocates for all who suffer the indignity and pain of servitude and injustice. I am deeply moved by this timeless cry to stand up to oppression, tyranny, and discrimination -- wherever they are found. As you prepare your homes and your hearts for this Passover season, please know that Bill, Chelsea, and I join you in celebrating freedom and family. Hag Sameach -- May this be a season of joy for all!"
Hillary Clinton ,D,s,"April 18, 2008",Statement by Hillary Clinton on Senator Obama's Debate Complaints,"Senator Clinton Responds to Senator Obama's Complaints about the other night's debate PHILADELPHIA  In response to a question on Fox 29 Good Morning Philadelphia this morning about Barack Obama's complaints on Wednesday night's debate questions, Senator Hillary Clinton had this to say: YouTube link and transcript of Hillary Clinton's response: http://www.youtube.com/watch?v=8_2_N3L0OAU ""Can I say that I've been through, what, 23 of these debates? And as I recall, I was asked some pretty tough questions in nearly every one of them. That goes with the territory. Having been inside the White House, I know the pressures inside the White House; I know how hard it is every single day. When the going gets tough you can't run away. And it's going to be tough going to deal with these hard problems; getting out of Iraq in the right way, turning the economy around, getting universal health care, ending our dependence on foreign oil. The special interests are going to be a lot tougher than 90 minutes of questions from two journalists and we need a president who is going to be up there fighting everyday for the American people and not complain about how much pressure there is, and how hard the questions are."""""
Hillary Clinton ,D,s,"April 22, 2008",Statement from Hillary Clinton on Equal Pay Day,"Equal Pay Day, the day that women's wages catch up with our male counterparts from the previous year, reminds us that while Americans have made great strides towards equality, we still face important challenges. ""Even forty years after the Equal Pay Act was signed into law, women only receive .77 cents for every dollar men earn, and the gap is significantly more for women of color. In Pennsylvania, women who work full time earn 74.8 percent of what men earn. In Indiana, its 72.6, and in North Carolina women earn 79.7 to each dollar earned by men. On average, families forfeit $4,000 a year because women don't receive equal pay for equal work. I am a proud sponsor of the Paycheck Fairness Act, which will toughen penalties in enforcing the provisions of the Equal Pay Act and help realize the promise of pay equity. ""There are heroines standing up for equal pay for equal work. Lilly Ledbetter, whose years of pay discrimination were upheld by the Supreme Court because she did not file a lawsuit before she had evidence of the discrimination, inspired me and my colleagues to introduce legislation to ensure that cases like hers are decided on the merits not on technicalities. ""As the voters in Pennsylvania go to the polls today, the wage gap is a stark reminder of what is at stake in this election. As President, I will continue to work for pay equity because it's not a woman's issue, it is a fairness issue and it is a family issue."""
Hillary Clinton ,D,s,"April 22, 2008",Hillary Clinton Statement on Earth Day,"On Earth Day, we embrace our responsibility to each other and to future generations: every one of us, from the President in the White House to children in schools to CEOs in boardrooms can help protect the environment and save our planet. That is the spirit that gives this day meaning. That is the call to citizenship that will help us solve the climate crisis and meet other threats to our environment. And that is why it is so important we elect a new president who will boldly and immediately set a new course. When I am president, our nation will lead the world to tackle the climate crisis - and lead the global economy in new clean energy industries. I have a plan to promote energy independence, address global warming, and transform our economy by creating five million new jobs. I will reduce global warming emissions by 80% below 1990 levels and establish a market-based cap-and-trade system to efficiently allocate pollution permits. I will cut foreign oil imports by two-thirds from 2030 projected levels, more than 10 million barrels per day; raise fuel efficiency standards to 55 miles per gallon by 2030; invest $150 billion in renewable, alternative energy; and ensure that 25% of our electricity comes from renewable sources by 2025. I will end the Bush Administration's assault on environmental protections and standards. And climate researchers in our government will no longer be silenced - their results manipulated - to adhere to a radical ideological agenda. It will be a new day. But meeting these big environmental challenges will take both new leadership and renewed citizenship. I encourage all Americans to find ways in their own lives to reduce their carbon footprints, to conserve energy, to protect greenspace in their communities, and to take other steps to safeguard our planet. We are all stewards of this Earth, and we must all be part of the solution."
Hillary Clinton ,D,s,"April 23, 2008",Hillary Clinton Statement on McCain Opposition to Equal Pay Legislation,"In response to the U.S. Senate rejecting the Lilly Ledbetter Fair Pay Act, a bill that would have provided American women with the legal recourse to challenge workplace discrimination when it occurs, Hillary Clinton issued the following statement: ""I was proud to be an original co-sponsor of this legislation, which would help deliver on the promise of equality and fairness in the workplace, and I am deeply disappointed 42 of my colleagues did not see fit to pass it. I am particularly disappointed that Senator McCain skipped the vote on this important legislation, and indicated that he would not have supported it had he been there. ""Senator McCain has yet again fallen in line with President Bush while middle class families are falling by the wayside. Senator McCain would rather pass laws to cut corporate taxes by $100 billion more - than pass laws to protect the civil rights of women earning thousands less than their male counterparts. Women are earning less but Senator McCain is offering more of the same. ""As president, I will never waver in my support for equal pay for equal work. I'm proud to be the sponsor of the Paycheck Fairness Act, which would increase sanctions for violating the Equal Pay Act and provide stronger protections for women whose rights have been violated. I think it's long past time we put equal pay at the top of the national legislative agenda, to demonstrate that as a nation, we value the skill, talent and hard work of every American, including every American woman."""
Hillary Clinton ,D,s,"April 25, 2008",Hillary Clinton Statement On World Malaria Day,"Today, on the first-ever World Malaria Day, we are reminded of the global tragedy that every thirty seconds a child in Africa dies of malaria. We have the tools to stop these deaths, and to protect and treat children and their families across the world who go to bed every night fearing that they are one mosquito bite away from despair and devastation. That is why in November, 2007, I unveiled an ambitious plan to combat malaria and the poverty that results from debilitating and deadly infectious diseases. My plan includes $1 billion per year to address malaria infection in Africa, with the goal of stamping out malaria deaths in Africa altogether by the end of my second term. I was pleased to see that this commitment was adopted by the U.S. House of Representatives last month when it approved a five-year, $1 billion a year, investment in malaria for the first time ever as part of the Tom Lantos and Henry J. Hyde U.S. Global Leadership Against HIV/AIDS, Tuberculosis and Malaria Reauthorization Act of 2008. The Senate Foreign Relations Committee has also included $5 billion over 5 years for malaria in their version of the reauthorization, and I look forward to working with my colleagues to help bring the resources to bear upon this epidemic. We need a comprehensive assault on malaria, which needlessly kills more than 1 million people each year and consumes 40% of public health expenditures in many African countries. Combating malaria is also critical to strengthening health infrastructures and effectively combating AIDS, tuberculosis and other diseases. If we act boldly, we can win the fight against malaria. We can end the needless death and suffering of millions and move toward the long-term goal of completely eradicating malaria from the planet. And by raising hope, opportunity and human dignity for millions, we can help restore America's moral leadership around the world."
Hillary Clinton ,D,s,"April 25, 2008",Statement by Senator Clinton on Recent Developments Regarding North Korea,"The Bush Administration's refusal to meet or negotiate seriously with North Korea in its first five years has been enormously costly to our national security. During those years, it is estimated the North produced enough plutonium for up to ten nuclear bombs. It conducted its first nuclear test. It has continued its proliferation activities, including as we have learned in recent press reports, helping Syria build a nuclear reactor. We must remain vigilant about Syria. The nature of its nuclear cooperation with North Korea strongly suggests an intention to acquire nuclear weapons. That is unacceptable, and the United States must work closely with the IAEA, countries of the Middle East, and others in the international community to make sure that never happens. <>North Korea's nuclear weapons program must be terminated. The Bush administration's efforts were not only late in starting they are still incomplete. A much better and more robust agreement was available at the beginning of President Bush's term. Nevertheless, that is not a reason to withdraw support for the ongoing negotiations. Pyongyang must make a full and accurate accounting of its nuclear activities, and the Bush administration must push much harder for them to do so in a verifiable manner. At the end of the day, North Korea has to establish a credible track record that can only come through the voluntary declaration of all its nuclear activities. As President, I will work with the members of the six-party talks to ensure that Pyongyang fulfills its commitment to completely and verifiably eliminate its nuclear weapon programs, and stop proliferation. These will be prerequisites for normalized relations with the United States."
Hillary Clinton ,D,s,"April 25, 2008",Statement by Hillary Clinton Reacting to False Attacks from Senator Obama About the Oil Industry,"Hillary Clinton made the following statement today at a ""Solutions for America"" town hall in Bloomington, IN in response to false attacks from Sen. Obama about the oil industry. ""Earlier today my opponent attacked me on energy issues. He claimed he would take on the special interests. But we've heard him say that before, but he voted, which I think is always the way to figure out where somebody truly stands. My late father used to say 'watch what they do, not what they say' and that 'actions speak louder than words.'"" ""When it came time to stand up against the oil companies and stand against Dick Cheney's energy bill, my opponent voted for it and I voted against it. And that bill had billions of dollars in giveaways to the oil companies. It was the best bill that the energy companies could buy. ""I know that my opponent has run ads claiming that he does not take money from oil companies. Well no one does. It's illegal. It's been illegal for 100 years to take money from oil companies."" ""Then my opponent puts up an ad saying he doesn't take money from oil company PACs. In March, he took more money from oil company executives than any candidate, Republican or Democrat. So I think it's important for you to know the facts."" Here is additional background on Sen. Obama's attacks earlier today: http://facts.hillaryhub.com/archive/?id=7318"
Hillary Clinton ,D,s,"April 29, 2008",Statement by Senator Clinton on Senator McCain's Health Care Proposals,"Today, Senator McCain announced new details to his health care plan that do little to make up for the fundamental flaws in his approach to health care. Senator Clinton issued the following statement: ""John McCain is proposing a radical plan that would mean millions of Americans would lose their job-based coverage: The McCain plan eliminates the policies that hold the employer-based health insurance system together, so while people might have a 'choice' of getting such coverage , employers would have no incentive to provide it. This means 158 million Americans with job-based coverage today could be at risk of losing the insurance they have come to depend upon. ""While Senator McCain touts the choices his plan offers, people who are older or sicker would actually have no choice under his new proposals. Older Americans or those with pre-existing conditions would be allowed to get only one type of coverage in a high risk GAP pool. That kind of arrangement does more to help insurers than individuals. In addition, high-risk pools fall far short of helping people in need. Virtually all high-risk pools today have waiting lists, high premiums, and scaled-back benefits. The millions of vulnerable Americans who lose employer-based coverage could have to wait months, maybe years, to access the GAP high-risk pools, if they are like the pools that exist today. To top it off, Senator McCain has offered no straight talk on how he would pay for these initiatives."" ""I am proud of the fact that I'm the only candidate in this race who has a health care plan that ensures quality, affordable coverage for all Americans. It is the right thing to do, but it is also the best way to lower costs for all Americans. It is past time that America address the health care crisis - not offer bandaids, or radical plans that undermine people's coverage - but real solutions. And that is what I will do as President."""
Hillary Clinton ,D,s,"April 30, 2008","Hillary Clinton Statement on ""Cover the Uninsured Week""","During this year's sixth annual Cover the Uninsured Week, we are reminded of the 47 million Americans who do not have access to quality, affordable health insurance, as well as those who are just a pink slip away from losing the coverage they have and those who are struggling to pay for their health care bills. Premiums have almost doubled since 2000, and today medical bills contribute to 50 percent of all personal bankruptcies. As President, I will make achieving universal health care my top domestic priority. Under my American Health Choices Plan, I will lower costs, improve quality, and cover every single American. Cover the Uninsured Week, a project of the Robert Wood Johnson Foundation and its many sponsors, encourages people to participate in events to raise awareness about the millions of people without health insurance and promote solutions for providing care for the uninsured. Improving our health care system has been a life long passion of mine, and I welcome the efforts of the Robert Wood Johnson Foundation and others to raise the profile of this issue. As First Lady, I helped create the State Children's Health Insurance Program (SCHIP) and I have worked to protect and expand the program as a U.S. Senator. It is unconscionable that in the richest country in the world, in this day and age, some people die because they do not have health insurance. As President, I will work to guarantee that every single one of us has access to quality care that is affordable. Under my plan, all Americans will have access to health care - no one will be left out. People who are satisfied with their current health care plans can keep them unchanged. Those who do not have coverage or are unsatisfied with their current plan will be able to choose from the same options available to Members of Congress or opt into a public plan option similar to Medicare, in a new national insurance pool. People who can't afford health care will receive a generous refundable tax credit so that their premiums never exceed a small percentage of their income, and small businesses will receive a tax credit for providing insurance to their employees. I will stop insurance companies from discriminating against people based on age, race, gender, or other risk factors like pre-existing conditions. And under my plan, insurance will be portable - people will not lose their coverage if they change or lose jobs. I have a plan to reduce costs throughout our health care system that includes making it a condition of doing business with the federal government that health plans cover high-priority preventive services. I have also proposed modernizing our health care system through the use of electronic medical records, which will make it easier for patients to access their medical information and could, according to one estimate, result in system-wide savings of tens of billions of dollars. To improve the quality of care, I have proposed establishing an independent public-private Best Practices Institute that will finance comparative effectiveness research so that health care providers and patients can access the treatments and medicines that work best. I will also provide funding for research that will provide health care professionals with additional methods to obtain the information they need to better serve their patients. I'm proud to be the only candidate in the presidential race to have a universal health care plan. In order to cover all of the uninsured people in our country, we must bring every stakeholder to the table. That is why my plan is based on shared responsibility. Efforts such as Cover the Uninsured Week encourage people to reach out to their neighbors and their communities to develop solutions and do what Americans do best by coming together and working toward a common goal."
Hillary Clinton ,D,s,"May 1, 2008","Statement by Hillary Clinton on ""Mission Accomplished"" Anniversary","The fifth anniversary of President Bush's ""Mission Accomplished"" speech comes the same week as a chief architect of the Bush administration's war in Iraq conceded ""We were clueless on counterinsurgency."" That statement confirms what we have all known: the planning and strategy was flawed. Our troops deserved and deserve better. ""All Americans honor the service and sacrifice of our men and women of the Armed Forces of the United States in Iraq. We are grateful for the tremendous burden they have carried. Our troops have done their job. ""The path forward is to use American diplomacy and our allies to allow U.S. forces to come home, and turn responsibility back to Iraq and its people. ""That is the plan I have laid out to the American people as a Senator and as a candidate, and that is the plan that I will carry out as President."""
Hillary Clinton ,D,s,"May 1, 2008",Statement from Hillary Clinton on National Prayer Day,"Today, million of Americans will come together for the 57th Annual National Day of Prayer. I joined this morning with a group of ministers. Our prayers were for our nation and for strength and wisdom to be good leaders. It is important that we all recognize that praying for our country, praying for people in positions of authority is what people of faith are called upon to do. This is a day about unity and common ground as our prayers in all their diversity of faiths can bring us together in our common goals for our families, communities and our nation."""
