Candidate,Party,Type,Date,Title,Speech
Hillary Clinton ,D,s,"February 7, 2007","Statement of Hillary Clinton on Announcement of the ""Better Health Care Together"" Campaign","Washington, DC -- In response to today's formation of the ""Better Health Care Together"" campaign, Hillary Clinton released the following statement praising the coalition's announcement: ""The worst kept secret in America is that the health care system is not working for the vast majority of people in our country. Costs are spiraling out of control, already high premiums are getting higher and health care is getting further and further out of reach for millions of uninsured and underinsured Americans. Universal health care is not only a moral and health imperative, but an economic and jobs imperative as well. ""I have learned from experience that we cannot achieve the goal of health care for every American if we don't have buy-in from employers, government, and labor. Today's announcement by America's largest employer and some of America's largest unions, along with organizations from across the political spectrum, is one more piece of evidence that there's broad agreement that Americans deserve a health care system that covers everyone and lowers costs. ""Passage of a universal health coverage plan will be one of my top priorities as President. It is time for bold yet practical solutions and I will use today's encouraging news to continue my efforts to build support for universal health care."""
Hillary Clinton ,D,s,"February 23, 2007",Clinton Statement on Vilsack Withdrawal,"Following is a statement released today by Senator Hillary Clinton: ""I have been proud to work with Tom Vilsack for years on the challenges facing our country, and I have a deep admiration for both Tom and Christie. ""Tom has made Iowa a leader in renewable energy and created thousands of jobs as one of America's great governors. We share a passion for protecting America's young people through expanded health care options, early childhood education initiatives and opening the doors to higher education to every American. ""I know he will continue to contribute to the dialogue about how to move America forward."""
Hillary Clinton ,D,s,"March 6, 2007",Clinton Statement on Bush Administration's Yucca Legislation,"In response to the Bush Administration's recent announcement that it would reintroduce legislation on Yucca Mountain, Senator Hillary Clinton issued the following statement. ""The Bush Administration's latest announcement that it will continue to pursue its misguided policy on Yucca Mountain is very disappointing. ""I've long opposed using Yucca as a site for nuclear waste. Yucca mountain is not a suitable place for long-term storage of our nuclear waste. There are too many unanswered questions about both the geology of the site and integrity of the science done to support the decision to store waste there. ""It's past time to start exploring alternatives to Yucca mountain, because we need to find a safe, secure long-term waste storage solution. As President, I would work with the scientific community to address this problem and come up with alternative solutions."""
Hillary Clinton ,D,s,"March 8, 2007",From the Senate: Statement of Senator Hillary Rodham Clinton on International Women's Day,"Washington, DC -- More than a decade ago, I had the honor of participating at the United Nations' Fourth World Conference on Women. Today, on International Women's Day, we have the opportunity to once again reaffirm the message that human rights are women's rights, and women's rights are human rights. There has been much progress made. The number of women in the Senate and House of Representatives has reached an all-time high. According to the United Nations Development Fund for Women, the number of countries that have enacted laws against domestic violence has almost doubled within the past four years. And the Nobel Peace Prize was awarded jointly to the Grameen Bank and its founder, Dr. Muhammad Yunus, in recognition of the impact and importance of microfinance programs, which have helped millions of women and families around the world. But there is still a great deal of work we must undertake to help women achieve equal rights, equal protection, and equal status in their communities. This year's theme for International Women's Day is ""Ending Impunity for Violence Against Women and Girls."" The silent epidemic of gender based violence affects far too many women and families, both in the United States and around the world. According to a 2005 study by the World Health Organization, more than 50 percent of women in some countries surveyed reported experiencing physical or sexual abuse at the hands of their partners. The same study found that the majority of women who had experienced intimate partner violence did not seek help, owing not only to stigma and fear, but difficulty accessing the services that would enable them to escape such violence. Gender-based violence is not only a criminal issue, but a health issue. Women who have experienced domestic violence are at increased risk of contracting HIV. In our efforts to prevent AIDS in the United States and around the world, we need to ensure that women are in position to protect themselves against AIDS without fear of violence or sexual assault. In addition to intimate partner violence, too many women and girls around the world are vulnerable to other forms of violence. According to the United Nations, situations of armed conflict result in increased number of rapes, sexual violence and slavery for women. In some countries, women who have been raped or sexually assaulted are at risk of being murdered in so-called ""honor killings,"" which only increase the fear and stigma that women face. UNICEF reports that about three million girls experience female genital cutting every year. But there is hope out there. In the West African countries of Senegal, Burkina Faso, and Guinea, hundreds of communities have pledged to end the practice of female genital cutting. Women who have been subjected to abuse and sexual assault, like Mukhtaran Mai of Pakistan, have turned their tragedies into an opportunity to create positive cultural change. These examples show that we can -- and we must -- bring this violence out of the shadows, and ensure that violence against women is treated as the crime that it is. I believe that by supporting the brave individuals who stand up and speak out against gender based violence, we can make significant gains in achieving human rights for all women and men. I will work with my colleagues in Congress to support the elimination of violence against women, and help women and girls around the globe live their lives free from the threat of harm."
Hillary Clinton ,D,s,"March 12, 2007",Statement of Hillary Clinton on the Projected Shortfall in HAWK-I Program,"One of my proudest accomplishments is working in the Clinton Administration to establish the State Children's Health Insurance Program in 1997. As Senator, I've worked to strengthen the program and as President, I will ensure that every child -- every person -- has health insurance. I've been outraged that President Bush has not taken action to stave off shortfalls in this program which has meant so much to so many Iowa families. Tens of thousands of children in Iowa do not have health insurance. That will get worse, not better, if the President gets his way. ""Iowa has done a remarkable job enrolling children in the HAWK-I program, more than tripling the number of kids with coverage over the past six years. The projected shortfall in Iowa would force the state to cut the number of enrolled kids in half - crippling the progress of the past six years. I will be working closely with my colleagues in the Senate to ensure that no state is forced to cut children from the SCHIP program. We should be expanding coverage, not cutting it. As I announced a few weeks ago, I will be introducing legislation that will expand SCHIP to help states cover every child. And as President, I will work tirelessly to have universal coverage so that no child -- no person -- in America has to worry about losing their health coverage."" Background: According to a 2006 survey sponsored by Robert Wood Johnson, 50,000 children in Iowa do not have health insurance. According to the report, uninsured children are twice as likely not to receive any medical care in a given year compared to kids with insurance.  15,700 children in Iowa will be dropped - DM Reg. 3/12/07 Anita Smith, Chief of the bureua of medical support, Iowa Dept. of Human Services.  31,819 - number of children in Iowa enrolledin the HAWK-I Program by federal budget year 2006 55,000 - number of uninsured Iowa kids according to Policy Project, Mount Vernon Iowa-based research group. DM Reg. 3/12/07 "
Hillary Clinton ,D,s,"March 13, 2007",From the Senate: Statement of Senator Hillary Rodham Clinton on the Firing of U.S. Attorneys,"Washington, DC -- ""With the White House now acknowledging a direct role in the Justice Department's U.S. Attorney firings, the president must affirmatively step forward to explain what he is doing to address the politicization of our prosecutorial system and what role he and his aides played in this controversy. ""The president is the chief executive of the country and this matter goes to the heart of his ability to manage our federal law enforcement and U.S. Attorney system. It is imperative that the president act swiftly to explain what role the White House played in this situation, hold those who acted inappropriately accountable, and take responsibility."""
Hillary Clinton ,D,s,"March 19, 2007",Hillary Clinton Statement on Iraq War Anniversary,"Today is the fourth anniversary of the start of the Iraq War. Those who have fallen have paid the ultimate price on our behalf and we continue to honor them and their families. It has become painfully clear over the last few weeks that we are doing a woefully inadequate job of taking care of our wounded. It is imperative that we improve our efforts on behalf of these troops immediately. A nation at war has a solemn obligation to do all it can for those who serve it on the battlefield. Four years ago, the Bush Administration launched a pre-emptive war in Iraq. Tragically, it misjudged the number of troops needed, miscalculated the cost, and mismanaged the mission. As a result, our nation now finds itself policing a sectarian conflict, our options are much more limited and it seems we're likely to have troops in Iraq for longer than any of us would like. The President is calling for patience. But Mr. President, the American people's patience has worn thin. It is time to change the course in Iraq so that we can start bringing our troops home. I am fighting to cap the number of troops in Iraq in order to stop the President's escalation and have proposed a phased redeployment of our troops so we can begin bringing them home. I've introduced comprehensive legislation that, if followed, would provide a roadmap out of Iraq. I hope that George Bush ends this war. But make no mistake -- if he doesn't, as President, I will."
Hillary Clinton ,D,s,"April 2, 2007",Statement by Hillary Clinton on Passover,"Hillary Clinton made the following statement in honor of Passover: ""I wish to extend my best wishes to everyone celebrating the holiday of Passover, commemorating the story of the Israelites' escape from slavery and reminding us all of the blessing of freedom. The Passover Seder is a wonderful tradition, bringing friends and family together to tell this important story to each generation. As we honor the celebration of Passover this week, let us also keep in mind those who are still struggling to escape from persecution throughout the world. We wish for them too the ability to live in peace and freedom with their families."
Hillary Clinton ,D,s,"April 18, 2007",From the Senate: Statement on Supreme Court's Gonzales v. Carhart Decision,"Washington, DC -- ""This decision marks a dramatic departure from four decades of Supreme Court rulings that upheld a woman's right to choose and recognized the importance of women's health. Today's decision blatantly defies the Court's recent decision in 2000 striking down a state partial-birth abortion law because of its failure to provide an exception for the health of the mother. As the Supreme Court recognized in Roe v. Wade in 1973, this issue is complex and highly personal; the rights and lives of women must be taken into account. It is precisely this erosion of our constitutional rights that I warned against when I opposed the nominations of Chief Justice Roberts and Justice Alito."""
Hillary Clinton ,D,s,"April 19, 2007","Statement by Hillary Clinton Commending Governor Lynch, New Hampshire Legislature for Leadership on Civil Unions","New Hampshire Soon to Become Fourth State to Adopt Civil Unions  MANCHESTER, NH -- Senator Hillary Clinton today made the following statement regarding the upcoming passage of legislation that will make New Hampshire the fourth state in the nation to adopt civil unions. ""New Hampshire has a long history of protecting its citizens from discrimination, and I would like to commend Governor Lynch and the New Hampshire legislature for their commitment and support for the civil rights of gays and lesbians,"" said Senator Clinton."
Hillary Clinton ,D,s,"April 23, 2007",From the Senate: Statement of Former President Bill Clinton and Senator Hillary Rodham Clinton on the Death of Congresswoman Juanita Millender-McDonald,"Washington, DC -- ""We are deeply saddened by the loss of Congresswoman Juanita Millender-McDonald. In the Congress, she brought her life experiences, her grit, her grace, and her sense of duty to the job, and her constituents and our country are better for it. As a former teacher, she never lost sight of our duty to the next generation and taught all of us a thing or two, whether she was standing against the genocide in Darfur or standing up for fair and free elections here at home. Our thoughts and prayers are with her family during this difficult time."""
Hillary Clinton ,D,s,"April 25, 2007",Statement from Hillary Clinton,"There are people right now in the world, not just wishing us harm but actively planning and plotting to cause us harm. If the last six years of the Bush Administration have taught us anything, it's that political rhetoric won't do anything to quell those threats. And that America is ready for a change. ""One of the great tragedies of this Administration is that the President failed to keep this country unified after 9/11. We have to protect our country from terrorism -- it shouldn't be a Democratic fight or a Republican fight. The plain truth is that this Administration has done too little to protect our ports, make our mass transit safer, and protect our cities. They have isolated us in the world and have let Al Qaeda regroup. The next President is going to be left with these problems and will have to do what it takes to make us safer and bring Democrats and Republicans together around this common mission of protecting our nation. That is exactly what has to be done and what I am ready to do."""
Hillary Clinton ,D,s,"April 25, 2007",Clinton Statement On Election of Darren Soto to Florida House of Representatives,"The following is a statement from Senator Hillary Clinton on the election of Darren Soto to the Florida House of Representatives. ""Darren Soto's victory is the latest example that Americans are ready for change. I look forward to working with Darren and other Florida Democrats as we offer Americans real change from the State House to the White House. I want to congratulate Darren for running a great race in Florida's 49th District. After spending time with him earlier this year in Orlando, it's clear that Darren is an exciting young leader who can get results in Tallahassee."""
Hillary Clinton ,D,s,"April 26, 2007",Statement from Senator Clinton on Iowa Discrimination Bill,"I applaud the Iowa State Legislature for their efforts to end discrimination and make the state more welcoming. I've supported similar legislation in the US Senate because too many Americans suffer as a result of bigotry, and I believe this legislation will help reinforce our fundamental belief in equality and justice for all. As President, I will work with Congress to echo the clear message of fairness Iowa's leaders sent today."""
Hillary Clinton ,D,s,"May 1, 2007",Statement of Hillary Clinton on Asian Pacific American Heritage Month,"It is my immense pleasure to celebrate Asian Pacific American Heritage Month to recognize, honor and express gratitude to Asian American and Pacific Islanders (AAPIs), who have been an integral part of our American story, helping build and strengthen America. ""For centuries, America has been enriched by our diverse Asian American and Pacific Islander communities and by the contributions that Chamorros, Native Hawaiians, and Samoans have made in their ancestral homelands. We can see those contributions today in the national railroad system that many AAPIs helped to build as well as the many AAPI men and women who serve with honor in our United States Armed Forces today. The tradition of public service runs deep in the history of AAPIs in America. From Dalip Singh Saud, who was the first Asian American to serve in Congress, to the great Patsy Mink, the very first woman of color to ever serve in Congress, to Norman Mineta who was the first Asian American appointed by a President to serve as a Cabinet Secretary, AAPIs have served this country with honor and distinction. And it is not just the famous names and faces that have left a bold imprint on the fabric of our nation. Leaders of community based organizations, small business owners, and the growing number of AAPIs in public service demonstrate what is best and what is possible in America. I salute the contributions and sacrifices that AAPIs have made to ensure a better life for their families and for American society. ""The numerous accomplishments of the AAPI community, however, can mask the challenges that still exist for many - discrimination, language barriers, and poor access to quality, affordable health care. As Senator, I have worked with the AAPI community to promote policies that help meet the community's underserved needs. For example, I sponsored the Legal Immigrant Children's Health Improvement Act to restore access to health care for low-income legal immigrant women and children as well as the Access to Employment and English Acquisition Act to provide more job training funds for people with limited English skills. ""Although some AAPIs have reached the pinnacle of higher education, I am fully aware that others in the AAPI community continue to remain behind. For this reason, I have been a strong advocate for making college affordable and accessible. As Senator, I fought to increase the federal Pell Grant, which today covers only a third of tuition at an average public college and co-sponsored the DREAM Act, which makes it possible for hardworking young people to receive in-state tuition at state colleges. I also led the passage of legislation that will bring more qualified teachers into the classrooms and more outstanding principals to lead our schools. ""As we consider reform to our current broken immigration system, we must address issues like family reunification. Under our current system, families are separated for long periods of time, sometimes decades. Last year, during the debate on the comprehensive immigration reform, I offered an amendment to address the backlog of family visas. I will continue to advocate for comprehensive immigration reform legislation that brings families together. ""Let's be clear, while we celebrate Asian Pacific American Heritage Month this May, I will continue working to ensure that AAPIs are included at the table everyday and that the needs of the community are prioritized year-round. As we celebrate the contributions of Asian Americans and Pacific Islanders, let us all rededicate our efforts to creating better opportunities and brighter futures for all Americans."""
Hillary Clinton ,D,s,"May 1, 2007",Statement of Hillary Clinton on the Fourth Anniversary of President Bush Declaring 'Mission Accomplished',"Today is the fourth anniversary of what I consider to be one of the most shameful episodes in American history. Never before in our history has a President said 'mission accomplished' when the mission had barely begun. Never before has a President landed on the deck of an aircraft carrier to proclaim the end of major combat operations to a war that rages on four years later. Never before has a President pulled a political stunt when so many American lives were and remain in harm's way. The President took us to a preemptive war of his choosing based on his assessment of faulty evidence and trumped up facts. He ignored the warnings of senior military advisors and he retaliated against those who tried to stop him. And once he got the authority to put inspectors back into Iraq, he ignored their findings. It is something that will stand as one of the darkest blots on leadership we've ever had in our nation's history. America is ready for a President who will respect our Armed Forces by properly planning for the missions we ask our troops to undertake. America is ready to end this war and when I am President, that's exactly what I'll do."
Hillary Clinton ,D,s,"May 1, 2007",Statement Of Senator Hillary Rodham Clinton on the President's Veto of the Emergency Supplemental Appropriations Bill,"Washington, DC -- ""With his veto today, President Bush has made it clear that he is standing in the way of ending the war in Iraq and bringing our troops home. The nation is ready for the President to stop disregarding the will of the American people and to work with Democrats on a funding bill that will enable us to begin redeploying our troops. He has a chance to do just that when he meets with the Democratic leadership tomorrow. ""It has been four years since the President declared an end to major combat operations. It is my hope that the President will approach this next round of talks in good faith. ""I am also disappointed that with his veto, the President has taken us back a step in meeting the homeland security needs of our high-threat cities like New York City and vetoed $35 million in additional funding under the Urban Area Security Initiative. ""In addition, with his veto, the President has shirked his responsibility to address the growing health needs affecting those exposed to the toxic air around Ground Zero in the wake of 9/11 and vetoed $50 million in funding for 9/11 health, which would not only have helped provide treatment to those affected in the New York metro area, but also to responders from all over the country who are suffering from 9/11 health effects. This funding would have helped meet immediate health needs and allow 9/11 health programs to continue operating. Despite the President's actions today, I will continue to fight, along with my colleagues in the New York delegation, to secure the federal commitment and funding required to meet 9/11 health needs in the long-term. ""The President has also chosen to veto critical legislation that would have ended the practice of giving Department of Homeland Security (DHS) contractors bonuses for incomplete or sub-par work, thereby saving taxpayers millions of dollars."""
Hillary Clinton ,D,s,"May 1, 2007",From the Senate: Statement of Senator Hillary Rodham Clinton on Need for Comprehensive Immigration Reform,"Washington, DC - Today's marches underscore the importance of comprehensive immigration reform. Our immigration system is broken, and it is past time that we came together and implemented an effective policy which respects our immigrant heritage, the rule of law, and human dignity. That is what I am committed to achieving. A comprehensive solution to our immigration crisis must include strengthening our borders, greater cooperation with our neighbors, strict but fair enforcement of our laws, federal assistance to state and local governments, strict penalties for those who exploit undocumented workers, and a path to earned legal status for those who are here, working hard, paying taxes, respecting the law, and willing to meet a high bar, including learning English. The solution must also protect the sanctity of families and repair the broken, unfair bureaucratic system that forces citizens and lawful immigrants to live apart from their spouses and children. Although many Republicans have tried to derail attempts at comprehensive immigration reform, I am committed to working with my colleagues to create an immigration system that respects our values. We must insist on comprehensive immigration reform that protects our homeland security and protects the dignity of millions of families who live here. There is a smart and effective, comprehensive solution to the impasse we face, and I will continue to pursue it."
