Candidate,Party,Type,Date,Title,Speech
Hillary Clinton ,D,s,"January 20, 2016",Statement on the Endorsement of the National Treasury Employees Union,"Hillary Clinton released the following statement after the National Treasury Employees Union endorsed her campaign for President. Clinton now has the endorsement of 22 national labor unions or labor alliances representing over 12 million American workers.""I am honored to have earned the endorsement of the National Treasury Employees Union and their 150,000 employees in 31 agencies and departments.""For decades, NTEU members have helped America workand along the way, they have helped build the American middle class by fighting for higher wages, paid family leave, and a secure and dignified retirement.""As President, I will always stand up for workers' rights and protect retirement security, including defined benefit plans and Social Security. I'm proud to stand with federal workers, including the men and women of NTEU, to build a better future for working families. Because when workers are strong, families are strongand when families are strong, America is strong."""
Hillary Clinton ,D,s,"January 22, 2016",Hillary Clinton Statement on the Endorsement of 'SMART',"Hillary Clinton released the following statement after SMART  the sheet metal, air, rail and transportation workers' union - endorsed her campaign for President. Clinton now has the endorsement of 23 national labor unions or labor alliances representing over 12 million American workers.""I am honored to have earned the endorsement of SMARTthe sheet metal, air, rail, and transportation workers' unionand their 216,000 members.""SMART members have helped build Americaand the American middle class, by fighting for higher wages, safe working conditions, and workers' rights to organize and bargain collectively.""As President, I will fight alongside SMART to protect workers' rights to organize and bargain collectively, stay safe on the job, maintain their health benefits and retire with dignity. And I will create more good-paying jobs by making significant investments in rebuilding and expanding our infrastructurefrom rebuilding roads, bridges, and freight systems to modernizing our energy grid. Because to build a strong economy for the future, we need to start by building strong infrastructure today."""
Hillary Clinton ,D,s,"January 25, 2016",Hillary Clinton Statement on Johnson Controls-Tyco Inversion Deal,"Today, after Johnson Controls and Tyco announced a merger estimated to yield the combined companies $150 million in tax savings by moving abroad to Ireland to shirk its U.S. tax obligations, Hillary Clinton issued the following statement on the inversion deal and her unique, tough and targeted plan to end these tax-avoidance measures that allow big corporations to avoid paying their fair share in the United States:""It is outrageous when large multinational corporations game the tax code and shelter money overseas to avoid paying their fair share, including through maneuvers like inversions. As I have said throughout my campaign, these efforts to shirk U.S. tax obligations leave American taxpayers holding the bag while corporations juice more revenues and profits. I have a detailed and targetedplanto immediately put a stop to inversions and invest in the U.S., block deals like Johnson Controls and Tyco, and place an 'exit tax' on corporations that leave the country to lower their tax bill."""
Hillary Clinton ,D,s,"January 26, 2016",Hillary Clinton's Statement on the Endorsement of Feminist Majority,"Hillary Clinton released the following statement today after Feminist Majority endorsed her campaign for President.""I am honored to earn the endorsement of Feminist Majority. Under the leadership of my friend Ellie Smeal, Feminist Majority has been a tireless advocate in the fight for women's equality. They have helped not only to elect more women to office, but to advance issues that are important to women and families across the country. They've championed pay equity and policies to confront domestic abuse. They've worked to expand economic opportunity including reproductive rights for all women. Today, women's health and rights are under attack like never before. The stakes could not be higher in this election, and the work groups like Feminist Majority do every day is vital in helping to build a better future for all our daughters and granddaughters. As President, I will proudly work alongside Feminist Majority to continue to build on the progress we've made and fight against any attempts to take us back."""
Hillary Clinton ,D,s,"February 11, 2016",Hillary Clinton Statement on Endorsement of Congressional Black Caucus PAC,"Hillary Clinton released the following statement after earning the endorsement of the Congressional Black Caucus PAC.The CBC PAC is the political arm of the Congressional Black Caucus, and works to increase the number of African Americans in the United States Congress:I'm honored to have earned the endorsement of the Congressional Black Caucus PAC, which has been fighting for enduring progress for almost 50 years. The CBC PAC knows we need to elect a President who can take on all parts of the job and build on the progress we've made under President Obamanot let it get ripped away.In America today, nearly one in three African-American men faces the prospect of prison in their lifetimes. African-American women working full time on average earn 60 cents for every dollar a white man earns. African Americans are nearly three times more likely to be denied a mortgage as whites. And African-American children are 500 percent more likely to die from asthma than white kids.As the ""conscience of Congress"", the CBC and its members fight for progress every day for African Americans and for all hardworking people in this country. They are working to give 35 million working people a raise by increasing the minimum wage, and to protect all Americans' sacred and hard-won right to vote. They are working tirelessly to help get more African-American candidates elected and, thanks to their efforts, more African Americans are serving in the United States Congress today than ever before.I have been proud to stand shoulder-to-shoulder with my close friends in the CBC in these fights. As a Senator from New York, I partnered with CBC members on bills to ban racial profiling, prosecute hate crimes, and promote equal pay for women. As Secretary of State, I created the Global Diaspora Forum, which helps Americans of African descent build partnerships with the countries their ancestors came from.The stakes in this election couldn't be higher. African Americans can't wait for solutionsthey need results now. We need a President who can stand up to the Republicans and win. I'll take on the gun lobby to address the epidemic of gun violence. I'll take on the Republicans who are disenfranchising voters and rolling back voting rights. And I pledge a new and comprehensive commitment to equity and opportunity for communities of color. That means reforming our criminal justice system and rebuilding the bonds of trust between our communities and our law enforcement officials. But it also means making major new investments to create jobs, to make it easier to start and grow a small business, to end redlining in housing, and to build reliable public transit systems."
Hillary Clinton ,D,s,"February 12, 2016",Statement on Plan to Ensure Safe and Responsible Natural Gas Production,"Today, Hillary Clinton released her plan to ensure safe and responsible natural gas production, which is the latest plank of her comprehensive plan to combat climate change and build a 21st century energy system.""Improving air quality and combatting climate change are too important to take any solution off the table. Switching to natural gas has avoided thousands of premature deaths and more than 100,000 asthma attacks by improving air quality, while creating good paying jobs and careers and helping reduce US carbon pollution to its lowest level in 20 years. With strong safeguards in place, natural gas can play an important role in our transition to a clean energy economy, complementing my plan to expand renewable energy and reduce energy costs by investing in building efficiency.""The United States should not be deciding energy policy pipeline-by-pipeline or project-by-project. That's not how we're going to build a 21st century clean energy system that will create jobs, make our economy more competitive, protect our communities, and combat climate change. As President, I will ensure natural gas production is safe and responsible in those communities that choose to pursue it. And I have a comprehensive plan to modernize our energy infrastructure, ensuring new pipelines are built to the highest labor and safety standards, and repairing and replacing thousands of miles of outdated pipelines by the end of my first term. We need a comprehensive strategy to modernize our energy infrastructure, power our economy, and meet the climate challenge. My plan would do just that."""
Hillary Clinton ,D,s,"February 13, 2016",Hillary Clinton Statement on the Passing of Supreme Court Justice Antonin Scalia,"Hillary Clinton issued the following statement on the passing of Supreme Court Justice Antonin Scalia:""My thoughts and prayers are with the family and friends of Justice Scalia as they mourn his sudden passing. I did not hold Justice Scalia's views, but he was a dedicated public servant who brought energy and passion to the bench.""The Republicans in the Senate and on the campaign trail who are calling for Justice Scalia's seat to remain vacant dishonor our Constitution. The Senate has a constitutional responsibility here that it cannot abdicate for partisan political reasons."""
Hillary Clinton ,D,s,"February 19, 2016",Hillary Clinton Statement on the Endorsement of Congressman Jim Clyburn,"  Today, South Carolina Congressman Jim Clyburn endorsed Hillary Clinton citing that she is the best candidate to take on challenges that face our country by working to achieve equal pay for equal work, reforming our criminal justice system, and investing in Historically Black Colleges and Universities. Hillary Clinton released the following statement on Congressman Clyburn's endorsement:""I am incredibly honored to have earned the endorsement of South Carolina's Congressman Jim Clyburn, a lifelong progressive champion of affordable health care, educational opportunity, and civil rights. I'm very grateful also to his wonderful wife, Emily. The Congressman is committed to making real change for working people in South Carolina and across the countryand is as creative a legislator as he is tenacious. I look forward to working with him to fight for universal health care, make college affordable, protect the environment, end red-lining in housing once and for all, make it easier to start and grow small businesses, expand his innovative '10-20-30' approach to invest in underserved communities and break the cycle of intergenerational poverty, and find every way we can to help families get ahead and stay ahead. Congressman Clyburn knows we need to break down every barrier holding Americans backbecause America can't live up to its full potential until we make sure every American has a chance to live up to theirs."""
Hillary Clinton ,D,s,"February 23, 2016",Statement from Hillary Clinton on Guantanamo Bay,"Hillary Clinton released the following statement on President Obama's plan to close Guantanamo Bay:""I support President Obama's plan today to close the detention facility at Guantanamo Bay and finally close the door on this chapter of our history. Over the years, Guantanamo has inspired more terrorists than it has imprisoned. It has not strengthened our national security; it has damaged it. That's why I backed closing Guantanamo as a Senator, and when I ran for President in 2008, as did both then-Senator Obama and Senator McCain. As President Obama's Secretary of State, I appointed a special envoy and worked with our friends and partners around the world to repatriate or resettle prisoners, with all appropriate monitoring and security. Closing Guantanamo would be a sign of strength and resolve. Congress should implement President Obama's plan as quickly and responsibly as possible."""
Hillary Clinton ,D,s,"February 24, 2016",Hillary Clinton Statement on Senate Republicans' Announcement to Block SCOTUS Appointee,"Hillary Clinton released the following statement in response to the Senate Republicans' announcement to block any SCOTUS appointee by President Obama:""The Senate Republicans' announcement today that they will refuse to consider any appointee by President Obama for the Supreme Court  no hearing, no debate, and no vote, on any potential nominee  is shameful and indefensible. Some Republicans have even suggested President Obama has no right to nominate anyone, as if somehow he's not a real President. The Senate has never taken more than 125 days to vote on a Supreme Court nominee, and on average a confirmation or rejection has taken just two months. The Senate Republicans' refusal to hold hearings on any nominee by President Obama is unprecedented, and it is an offense to the President and to the American people who elected him. What's more, they are hindering the Court from doing its work  leaving it with only eight members for the remainder of this term and into the next. It's time for the Senate to put statesmanship over partisanship, and live up to our constitutional principles."""
Hillary Clinton ,D,s,"February 29, 2016",Hillary Clinton Statement on Endorsement of Congressional Hispanic Caucus BOLD PAC,"Hillary Clinton released the following statement after earning the endorsement of the Congressional Hispanic Caucus (CHC) BOLD PAC. BOLD PAC is the political arm of the Congressional Hispanic Caucus.""I am honored to have earned the endorsement of the Congressional Hispanic Caucus BOLD PACa strong voice in Congress and across the country for the Latino community.""I have always been proud to stand with the Latino community not only in fighting for comprehensive immigration reform, but fighting for all families to have the chance to get ahead and stay ahead. As a Senator, I was proud to vote for Ted Kennedy's immigration reform bill in 2007 and to co-sponsor the DREAM Act in 2003. As President, not only will I protect President Obama's executive orders and look to go further, but I will fight for comprehensive immigration reform legislation from the moment I take office. While immigration reform is vital for our families, our economy, and our future, it's not the only issue where the Latino community needs progress. Nearly half of Latinos live in counties that don't meet EPA air quality standards. Latinos between 25 and 29 are less than half as likely to have a bachelor's degree as whites. Latinas working full time make just 54 cents for every dollar a white man earns. We need equal pay for women, environmental justice for families, and good schools in every ZIP code for our kids.""I am proud to stand with the CHC BOLD PAC in all of these fightsbecause I believe that when families are strong, America is strong."""
Hillary Clinton ,D,s,"March 7, 2016",Hillary Clinton Statement on the Anniversary of Bloody Sunday,"Hillary Clinton released the following statement on the 51stanniversary of BloodySunday:""Today, we remember March 7, 1965the day that will always be known as BloodySunday. The day that hundreds of courageous men and women set out on a peaceful demonstration, marching for their fundamental right of citizenshipthe right to vote. The day that they were stopped on the Edmund Pettus Bridge, beaten savagely, knocked unconscious, and chased through the streets by state troopers for daring to raise their voices.""It was a day of horror and pain. But it was also a day of resilience and grace. Because men like John Lewis would not be beaten down. Women like Amelia Boynton Robinson would not be silenced. And so many others whose names we may never know would not be intimidated. Their mission was a holy and righteous onea mission for dignity, justice, and equality. Bigotry and hatred may have blocked the Selma march that day, but the long march to progress cannot be blocked on any given day.""But we know too well that our work is not done. Since 2010, the U.S. Supreme Court gutted the Voting Rights Act, and 21 states have enacted new voting restrictionsfrom slashing early voting to instituting burdensome voter ID laws. Alabamathe very state where the Selma marchers demonstratedpassed a voter ID law and then closed dozens of driver's license bureaus where citizens secure photo IDs, including in seven counties where more than two-thirds of the population is African American.""We should be making it easier for all citizens to vote, not harder. We should be working to lift each other up, not stop others from exercising their rights. And although we will fight, we should not have to fight to break down the many barriers holding Americans backeconomic barriers and educational barriers, barriers of environmental injustice, barriers of discrimination in all its forms. We should not have to remind people that Black Lives Matter. We should be striving to demonstrate that foundational principle of our countrye pluribus unum. Out of many, we are one. And it will only be when every person has a chance to live up to his or her God-given potential that America will live up to its full potential."""
Hillary Clinton ,D,s,"March 8, 2016",Hillary Clinton Statement on International Women's Day,"Hillary Clinton released the following statement on International Women's Day:""On International Women's Day, we celebrate women around the world, in all stations of life  mothers, daughters, grandmothers, teachers, doctors, soldiers, artists, workers, employers, leaders of all kinds. We celebrate their achievements and their humanity. We celebrate the progress we've made to advance the full participation of women in economies and societies. And most importantly, we recommit to finishing the unfinished work that remains, and ensuring that women and girls are treated as the full and equal human beings they are.""Advancing the status of women is not just the right thing to do; it's the smart thing to do. When women and girls participate fully, economies grow and nations are more secure. When their rights are denied, the opposite happens. No country can get ahead if half its people are left behind.""I've spent my career working to break down barriers that hold back women here at home and around the world. As President, I will keep up the fight. I'll fight to close the pay gap; make paid family leave a reality; ensure families have access to quality, affordable child care; increase the minimum wage; protect women's health and reproductive rights; confront violence against women; and promote women's rights around the globe. These issues ought to be core priorities of our government. They are not just ""women's issues""they are family issues, economic issues, and they're crucial to America's competitiveness and security.""This International Women's Day, let's take a page from the generations of women leaders around the world who never stopped working to make our world a better, more equitable place. And let's always remember that women's rights are human rights, and human rights are women's rights, once and for all."""
Hillary Clinton ,D,s,"March 9, 2016",Statement from Hillary Clinton on Iran,"Hillary Clinton released the following statement on Wednesday regarding new reports of Iranian missile tests and the nine year anniversary of Robert Levinson's disappearance:I am deeply concerned by reports that Iran has tested multiple missiles, which it claimed were stamped with words declaring that ""Israel should be wiped from the pages of history."" This rhetoric is repulsive and has no place in the community of nations, and as President I will continue to stand with Israel against such threats. This demonstrates once again why we need to address Iran's destabilizing activities across the region, while vigorously enforcing the nuclear deal. These missile launches constitute a blatant violation of Iran's UN Security Council obligations, and such violations must have consequences. Iran should face sanctions for these activities, and the international community must demonstrate that Iran's threats toward Israel will not be tolerated.We also need to hold Iran to its promise to help us locate and bring home Robert Levinson - who disappeared nine years ago today. We cannot rest until he is reunited with his family."
Hillary Clinton ,D,s,"March 9, 2016",Statement from Hillary Clinton on Iran,"Hillary Clinton released the following statement on Wednesday regarding new reports of Iranian missile tests and the nine year anniversary of Robert Levinson's disappearance:""I am deeply concerned by reports that Iran has tested multiple missiles, which it claimed were stamped with words declaring that ""Israel should be wiped from the pages of history."" This rhetoric is repulsive and has no place in the community of nations, and as President I will continue to stand with Israel against such threats. This demonstrates once again why we need to address Iran's destabilizing activities across the region, while vigorously enforcing the nuclear deal. These missile launches constitute a blatant violation of Iran's UN Security Council obligations, and such violations must have consequences. Iran should face sanctions for these activities, and the international community must demonstrate that Iran's threats toward Israel will not be tolerated.""""We also need to hold Iran to its promise to help us locate and bring home Robert Levinson - who disappeared nine years ago today. We cannot rest until he is reunited with his family."""
Hillary Clinton ,D,s,"March 9, 2016",Hillary Clinton Statement on the Endorsement of the Office and Professional Employees International Union,"Hillary Clinton released the following statement after earning the endorsement of the The Office and Professional Employees International Union (OPEIU), AFL-CIO. The OPEIU represents over 110,000 workers from all 50 states. Clinton now has the endorsement of 25 national labor unions or labor alliances representing more than 13 million employees.""I am honored to have again earned the endorsement of The Office and Professional Employees International Union (OPEIU).OPEIU and their members make our economy run. American workers built the middle class by fighting for higher wages, retirement security, and the right to collectively bargain. Now, working families are under attack by Republicans who want to strip workers of their hard-won rights and keep stacking the deck for those at the top.As President, I will stand up for workers and fight attacks on collective bargaining. I will fight to protect retirement security and finally secure equal pay for women and paid family leave for allbecause when unions are strong, families are strong, and when families are strong, America is strong."""
Hillary Clinton ,D,s,"March 14, 2016",Hillary Clinton Statement on Equality PAC Endorsement,"Hillary Clinton released the following statement on the endorsement of the Equality PAC, a political action committee formed by leaders of the Congressional LGBT Equality Caucus:""I'm honored to receive the endorsement of the Equality PAC and the leaders of the Congressional LGBT Equality Caucus, who are fighting every day for full and equal rights for LGBT Americans. We achieved a tremendous victory in the fight to make our country fairer and freer for all Americans when marriage equality became the law of the land last spring. But we all know our work is far from over. Too many LGBT Americans still face discriminationin employment, in housing, in education, in health carebecause of who they are or who they love. And the stakes in this election couldn't be higher. The Republican candidates for president have made it clear that, if elected, they won't stand with the LGBT community as they fight for the rights we all deserve.""As President, I will continue to fight alongside the LGBT community to pass the Equality Act and end discrimination in all its forms. I will fight to end the dangerous practice of 'conversion therapy' on minors and confront the epidemic of violence facing the transgender community, especially transgender women of color. And I will continue the efforts I led as Secretary of State to advance the human rights of LGBT people around the world.""And we need to recognize and honor the strength, courage, and determination of the advocates, activists, and countless heroic individuals who told us all that 'Silence = Death' and brought the AIDS crisis to the forefront of the national consciousness in the 1980s. They fought on the front lines of the crisis, from hospital wards and bedsides, some with their last breathand without them, we would not be where we are today in preventing and treating HIV and AIDS. They saved lives. And we can save more. We need to expand access to HIV prevention and treatment, work with states to remove outdated and stigmatizing HIV criminalization laws, and fight at every moment to achieve that which is at last within our reach: an AIDS-free generation.""I'm proud to stand with the Equality PAC in this fight to make our country and our world more just, fair, and equal."""
