Candidate,Party,Type,Date,Title,Speech
Lindsey Graham,R,p,"October 11, 2015",Press Release - ICYMI: Union Leader: Graham and McCain Take Friendship And Shared Campaign Message on the Road,"And McCain lauds him at every turn. Genuinely concerned that the world is in worse shape than it has been for decades, he says Graham is the right person to turn things around.""Graham And McCain Take Friendship And Shared Campaign Message On The RoadBy Eli OkunUnion LeaderOctober 11, 2015Lindsey Graham is smiling. He loves this unheated town hall auditorium, a picturesque little white building with wood-paneled floors and two dozen residents on folding chairs.""You have a piece of heaven,"" he says. ""If I wanted to show somebody what New England looks like, I would pick right here.""The South Carolina senator and Republican presidential candidate is telling the truth  he loves campaigning in New Hampshire. But after thanking his host, the pleasantries are over.He launches into his life story: growing up in a small town in South Carolina and raising his younger sister after both their parents died by the time he was 22. He stresses foreign policy and national security, sacrifice and safety.Unlike other candidates, he does not say ""yes, but"" when he disagrees with an audience member. He says no.With a Sunday News reporter tagging along for the day Saturday, Graham and Sen. John McCain of Arizona offered up Graham's message and enjoyed each other's company and conversation through meals, car rides and a long campaign schedule.For Graham, McCain is not only a political adviser but a close friend. ""Hard to find real friendship in this business,"" Graham remarks....Graham's campaign...is firmly focused on the future. McCain likes to note that New Hampshire residents have a tendency to wait until the last moment to make up their minds. Graham will be more than happy, he reasons, to hit the road, make his case again and again across the state, and wait for all the shooting stars to flame out....Throughout the day, McCain clearly delights in his old stomping grounds. And Graham loves having him around.One moment, McCain is making fun of Graham's accent or Graham of McCain's age. The next, McCain is pointing to a New York Times article about the Obama administration abandoning efforts to train Syrians against the Islamic State. He reads out the sub-headline in disgust: ""Admission of failure.""""Obama's incompetent and (Secretary of State John) Kerry's delusional is our two biggest problems,"" Graham says...The friends have forged a deep bond as fellow veterans and foreign policy wonks who have journeyed to the Middle East year after year to visit troops and talk military strategy....In response to questions, Graham's happy to drill into specifics on everything from gun control to the way European countries' oppositions to genetically modified organisms is prolonging hunger in Africa....And McCain lauds him at every turn. Genuinely concerned that the world is in worse shape than it has been for decades, he says Graham is the right person to turn things around....For Graham, the presidency would be the high point of decades of hard work in his political and personal life. He believes he can save the country from its current trajectory...And over lunch, he turns reflective when asked what he's learned about himself from the campaign so far.""Until you run for President, you never think of yourself as a sum of parts. ... I'm having to explain my entire life experience,"" he says. ""What I've learned is that I've lived a pretty interesting and full life.""This process makes you appreciate all the successes and all the struggles.""Whether his combination of sober analysis and sincere policy prescriptions  plus some witty asides  will pay off is yet to be seen. But Graham will keep plugging away, confident that this is the way to win, and to save the country. ""The only way forward for a guy like me is to do what we're doing today.""Read The Full Article Here."
Lindsey Graham,R,p,"October 12, 2015",Press Release - Graham's #FITN Tour: Weekend Campaigning With Senator John McCain,"Graham: ""We're Going To Rebuild Our Military, Not Close Down Facilities. If I'm President, There Would Be No More BRAC Commission.""Seacoast Online: ""Graham Spent The Day Touring Seacoast Facilities Before Traveling To Manchester With Supporter And Former GOP Presidential Candidate Sen. John McCain.""(Jesse Scardina, ""Sen. Graham at shipyard: No more base closures,"" Seacoast Online, 10/10/5)Over the weekend, Senator Lindsey Graham continued his 9-day tour of New Hampshire joined by two-time New Hampshire Primary winner Senator John McCain. During his third trip to the state this year, Senator McCain told voters that 'Graham is the right person to turn things around'when it comes to our nation's security.Take a look at some of the highlights from the weekend:Foster's: ""[McCain] Said He Is Campaigning With Graham Because He Believes Graham Is The Best Choice For The Country.""(Karen Dandurant, ""McCain joins Graham on campaign trail,""Foster's, 10/10/15)""'I believe the people of New Hampshire are not swayed by political ads,' McCain said. 'You make up your own minds, based on what you see. Well, our country is in crisis right now and we need a candidate who can bring us back to what we were. I think that is Lindsey Graham.""McCain spoke of the unrest in the Middle East and his opinion that Russia's Vladamir Putin is exploiting that because he senses weakness in the United States.""'The next president has to reverse eight years of a decline in our power,' McCain said. 'That person is here today.'""(Karen Dandurant, ""McCain joins Graham on campaign trail,"" Foster's, 10/10/15)From Visiting The Manchester Bingo Center...Boston Herald: ""McCain Urged The Group To Start A Buzz Around Town About Graham.""""McCain urged the group to start a buzz around town about Graham, who serves with him on the Senate Armed Services Committee. 'I don't care how much money you spend in New Hampshire. The people of New Hampshire examine the candidates,' McCain said. 'Consider this fellow. That's what I'm asking.'"" (Laurel J. Sweet, ""Lindsey Graham hopeful his experience will lead him to front of field,"" Boston Herald, 10/12/15)To Town Hall Meetings...To New Hampshire Style House Parties...Union Leader: ""South Carolina Sen. Lindsey Graham Made A Forceful Case That He Is The Best Presidential Candidate...""""South Carolina Sen. Lindsey Graham made a forceful case that he is the best presidential candidate to tackle his two top priorities  'too many terrorists and too much debt'  at a house party here Sunday afternoon... But he mostly focused on his passion: foreign policy and strengthening America abroad. A veteran who has made 35 trips to Iraq and Afghanistan, Graham said President Obama's withdrawal from Iraq and inaction in Syria have made the world more dangerous. Pointing to Obama's failure to follow through on his threat of a 'red line' when Bashar al-Assad used chemical weapons, Graham said, 'Russia and China saw that as weakness, and they're eating our lunch. And I'm tired of it.'"" (Eli Okun, ""Graham urges American strength at Hudson house party,"" Union Leader, 10/11/15)OANN's Neil McCabe: ""[Graham Believes] It Is His Personal Interaction With Voters That Will Put Him In The Lead."""" ...they liked what Graham and McCain had to say.That included Vietnam War veteran Thomas Scanlon, 66, of Salem.""'Sen. Graham has always stood up for veterans,' he said. 'Even if you disagree with them, you have to like what they have done for this country.'""(Doug Ireland, ""McCain stumps with Graham in Salem,"" Eagle Tribune, 10/10/15)"
Lindsey Graham,R,p,"October 13, 2015",Press Release - Graham's #FITN Tour: Day 5 Recap,"Graham: ""Voters Owe It To The Military To Pick A President Worthy Of Their Sacrifice""On day 5 of a 9-day tour in the first in the nation primary state, Senator Lindsey Graham delivered remarks at the No Labels Problem Solver Convention, visited the Sandwich Fair, hosted a meet and greet at the NH Veterans Home and attended a house party hosted by Kevin and Alice Major. In case you missed it, take a look at some of the buzz from day 5:""'I've spent time understanding this world, how this war [with radical Islam] got to where it is, and how to win it,' he told the Examiner.""The retired Air Force Reserves colonel added, 'I think every voter owes it to the military to pick somebody worthy of their sacrifice to be their commander-in-chief.'""(Gabby Morrongiello, ""Graham: 'Voters owe it to the military to pick a president worthy of their sacrifice,'"" Washington Examiner, 10/12/15)Photo by No Labels""'I don't think [the other candidates] can hold a candle to me when it comes to foreign policy...'""The Palmetto State's senior senator has more than three decades of experience in the military and frequently tells voters his extensive travel in the Middle East gives him a unique advantage as a presidential candidate...""'I've spent time understanding this world, how this war [with radical Islam] got to where it is, and how to win it,' he told the Examiner.""The retired Air Force Reserves colonel added, 'I think every voter owes it to the military to pick somebody worthy of their sacrifice to be their commander-in-chief.'""(Gabby Morrongiello, ""Graham: 'Voters owe it to the military to pick a president worthy of their sacrifice,'""Washington Examiner, 10/12/15)Discussing Foreign Policy At The No Labels Problem Solver Convention... Talking With NH Primary Voters At The Sandwich Fair..."
Lindsey Graham,R,p,"October 14, 2015",Press Release - Graham's #FITN Tour: Day 6 And #DemDebate Recap,"Graham: ""[McCain] Did 100 Town Hall Meetings In New Hampshire. I'm Going To Try To Duplicate That. I Think I'm The Best Person To Be Commander-In-Chief.""Yesterday, Senator Lindsey Graham spent the day by continuing his tour in New Hampshire where he visited local businesses, held a town hall meeting in Newport, and responded to reports that Iran is test launching a new ballistic missile. Senator Graham ended his day in the Granite State by attempting to watch the CNN #DemDebate. In case you missed it, take a look at some of coverage from yesterday including Graham's reaction to last night's debate:Conway Daily Sun: ""On Tuesday, Sen. Graham Responded To Reports Of Iran's Apparent Test Launch Of A New Ballistic Missile Capable Of Reaching Israel And Other U.S. Allies."" (Lloyd Jones, ""Graham plans to follow McCain's playbook in N.H.,"" Conway Daily Sun, 10/12/15)""Iran's apparent test launch of a new precision-guided ballistic missile capable of hitting Israel and other U.S. allies is dangerous new evidence of President Obama's disastrous policies and complete lack of leadership in the Middle East,"" he said. ""After capitulating to Iran on every major negotiating objective in his nuclear deal, which is set to release over $100 billion in funds to the Iranian regime, the Ayatollah has demonstrated exactly how he will use that money: building its war machine and strengthening its capacity to wreak havoc in the Middle East, terrorize our allies, and directly threaten the security of the United States.""Graham Expresses His Thoughts On The #DemDebate...From The Responses To Foreign Policy Questions...To Bernie Sanders' Understanding Of Russia...To Hillary Clinton's Response To Benghazi...To Just Basic Acknowledgement Of The Issues That Face Our Nation...FOX News: ""At Least One Candidate Couldn't Make It To The End Of The Night.""(Staff, ""Democratic debate GOP reaction: Huckabee tweet causes stir, Graham turns in early, FOX News, 10/14/15)After That Performance, Ready To Discuss Our Nation's Future In NH Today!Conway Daily Sun: ""[Graham] Plans To Hold More Than 100 Town Hall Meetings In The State"" And ""Will Spend Much Of Wednesday In Conway."" (Lloyd Jones, ""Graham plans to follow McCain's playbook in N.H.,"" Conway Daily Sun, 10/12/15)"
Lindsey Graham,R,p,"October 15, 2015","Press Release - IJReview: Lindsey Graham: ""Why We Need Troops on the Ground in Syria""","Our next president's greatest task is to undo the Obama Doctrine and reclaim our indispensable role as a force for global security. I am running for president because I am the only candidate with in-depth knowledge of these challenges and a detailed strategy for taking them on.""Why We Need Troops On the Ground in SyriaBy Senator Lindsey GrahamIJReviewOctober 15, 2015Our next president's greatest task is to undo the Obama Doctrine and reclaim our indispensable role as a force for global security. I am running for president because I am the only candidate with in-depth knowledge of these challenges and a detailed strategy for taking them on.I have made dozens of trips to the Middle East. I know the region and the players, and I understand fully what is at stake. I have concluded that most people are not buying what ISIL is selling, and I have a plan to stop them.Russia's entry into the Syrian war marks a dangerous new phase in this conflict, escalating the threat level against the United States and highlighting the consequences of President Obama's failure to project leadership in the Middle East. Putin has long been a factor in this crisis, helping to prop up Syrian President Bashar Assad with financial support and material. But the arrival of Russian troops and launching of Russian airstrikes on Syrian soil are harbingers of even greater violence, devastation, and instability.The beneficiaries of these developments will be:ISIL, who will be strengthened in their ability to recruit foreign fighters and exploit the chaos;Assad, the war criminal who has waged a brutal four-year assault against his own people;Iran, another Assad benefactor; andPutin, who is reclaiming a strong Russian position in the region.Those who will suffer most will be the Syrian people, neighboring nations like Lebanon and Jordan, the moderate Muslims who are seeking to reclaim the initiative from radical Islam, and the United States, as our interests are supplanted by Russia's and the risk of attacks on our homeland compounds.President Obama deserves much of the blame. He made the disastrous choice to withdraw our troops from Iraq in 2011, renewing instability and opening up a space into which ISIL and Iran expanded. He refused to help the Syrian people when they rose up against Assad, not even to enforce his own red line on the use of chemical weapons. This gave oxygen to the rise to ISIL and other terrorist groups, created a global recruitment magnet, and signaled clearly to the region and the world that Obama is as weak as he is untrustworthy. The resulting leadership vacuum has been readily filled by Sunni and Shia terrorists, the Iranian Ayatollah, and now Putin.Syria is now the perfect launching pad for devastating attacks against our homeland that could make the September 11 attacks pale in comparison. Seasoned fighters with Western passports will be in a position to inflict incredible harm. Tehran's emboldened and unchecked role in the Middle East is adding fuel to this fire, prolonging Assad's reign of terror and preventing a resolution to the conflict. Russia's arrival exacerbates this reality even further. The massive flow of Syrian refugees is not just a terrible humanitarian crisis. It threatens the stability of our close allies in the region and poses a considerable challenge to our friends in Europe, which, ultimately, undermines our own security.As president, I would increase our current presence of American troops in Iraq from 3,500 to 10,000 in order to turn the tide of battle. It brings me no pleasure to conclude we must send troops back into Iraq, but doing so would allow us to embed with Iraqi forces at the battalion level, as well as deploy attack helicopters to give the Iraqi army a substantial advantage over ISIL.I would put in place robust special operations capability to apply constant pressure on ISIL's leadership and supply better arms and equipment to the Kurds. Together these efforts would reclaim the gains of the Surge and restore stability in Iraq.However, the heart of the fight will be in Syria, where ISIL is headquartered. This will require a regional force with troops from Egypt, Turkey, Jordan, and Saudi Arabia. This is their fight, first and foremost. But it directly affects our security, and we must be a part of it to provide leadership and additional capability. I would also provide assistance in dealing with the enormous humanitarian crisis that is overwhelming the region and acting as a barrier to efforts to extinguish the flames of radical ideology.I will bring this detailed strategy to the White House. Most important, I will bring the will to defend our nation and restore America's global leadership role.I am the only candidate who has the credentials and strategy to keep America safe. As tempting as it may to withdraw from the terrible violence and chaos engulfing the Middle East, we have seen that terror will arrive on our shores if we don't confront it at the source.ISIL offers the people of the Middle East a glorious death. We must offer a hopeful life. In return, we will restore stability over there while increasing security here at home. I am running for president to ensure that we have the capability, capacity, and will to protect America and bring about a safer, more peaceful and prosperous world."
Lindsey Graham,R,p,"October 15, 2015",Press Release - Graham's #FITN Tour: Day 7 Recap,"Graham: ""I've Got Something Unique To Offer""Conway Daily Sun: ""Lindsey Graham Says He's The Candidate Who Can Push Back Against ISIL""(Daymond Steer, ""Lindsey Graham Says He's The Candidate Who Can Push Back Against ISIL,"" Conway Daily Sun, 10/14/15)Continuing a 9-day swing in the Granite State yesterday, Senator Lindsey Graham met voters in the Conway area and joined Fox News Business' After the Bell, Tony Perkins' Washington Watch and Fox News' On the Record with Greta Van Susteren to discuss unrest in the Middle East and recent reports that Iran is testing a new ballistic missile. Graham also participated inWMUR's Candidate Cafe earlier in the week. In case you missed it, take a look at some of the coverage from the #FITN tour:Graham Discusses Upbringing At WMUR's Candidate Cafe:""The Customers Were Sort Of Like Family. It Was Like Cheers Before Cheers.""(Josh McElveen, ""Candidate Cafe: Lindsey Graham,"" WMUR, 10/14/15)On President Obama's Failed Foreign Policy...Union Leader: ""It's A Foreign Policy Folly For The U.S. To Withdraw From Afghanistan...""""It's a foreign policy folly for the U.S. to withdraw all troops from Afghanistan, Sen. Lindsey Graham, R-S.C., said Wednesday. The Republican presidential hopeful reacted to news reports that President Barack Obama is reconsidering a complete withdrawal of forces...'The way I look at it, it's an insurance policy against another 9/11,' he said."" (Dan Tuohy, ""Graham says U.S. must keep some troops in Afghanistan,"" Union Leader, 10/14/15)Graham: ""You Should Be Concerned, Because Your Commander-In-Chief Has No Idea What He's Doing."" ""Now Everybody Including Cuba Is Walking All Over Obama. This Needs To Stop.""(On the Record with Greta Van Susteren, ""Graham: There's a 'coalition from hell' in Syria,"" Fox News, 10/14/15)""None of the people on the stage [Tuesday] night has a clue about how to defend this country. The biggest threat to America is not climate change; it's radical Islam with a weapon of mass destruction.""(On the Record with Greta Van Susteren, ""Graham: There's a 'coalition from hell' in Syria,"" Fox News, 10/14/15)Graham On Washington Watch: ""Obama Is Completely Incompetent When It Comes To Being Commander-In-Chief.""Graham Says If He's President, He Intends To Stop Radical Islam From Getting Nuclear Weapons.(Tony Perkins, ""Lindsey Graham,"" Washington Watch, 10/14/15)Graham: ""The Next President Of The United States Needs To Be Ready To Go""(After The Bell, ""Sen. Graham talks Trump, dealing with Putin,"" Fox News Business, 10/14/15)On Graham's #FITN Tour...Union Leader: ""[Graham] Said He's Learned A Lot About New Hampshire's Economy, Including Concerns About The Affordable Care Act Driving Up Costs For Businesses And Companies Struggling To Find Enough Qualified Help.""(Dan Tuohy, ""Graham says U.S. must keep some troops in Afghanistan,"" Union Leader, 10/14/15)And Just For Fun...The Washington Post: ""Lindsey Graham Joked At Rand Paul's Expense""#FITN"
Lindsey Graham,R,p,"October 16, 2015",Press Release - Graham's 9-Day #FITN Tour Wrap-Up,"NHPR: ""Graham Has Spent 42 Days In New Hampshire This Year, With Roughly 140 Campaign Stops. That Ranks Him Among The Most Frequent Travelers On The State's Primary Trail So Far.""(Paige Sutherland, ""Sluggish N.H. Campaign Doesn't Keep Lindsey Graham From Having a Blast, NHPR, 10/16/15)Today, Senator Lindsey Graham wrapped up a 9-day campaign swing in New Hampshire where he continues to make the case to Granite State voters that he's most qualified to be Commander-in-Chief and ready to lead on day one. In case you missed it, take a look at some of the coverage that the #FITN tour has garnered during the final days of the swing:NHPR: ""If There Is One Theme Graham Is Emphasizing During His Campaign Stops, It's His Focus On Foreign Policy."" (Paige Sutherland, ""Sluggish N.H. Campaign Doesn't Keep Lindsey Graham From Having a Blast, NHPR, 10/16/15)Graham: ""As The World Continues To Fall Apart, As Syria Goes Into Further Chaos, And Iran Develops Their Missile Technology, As ISIL Rises, People Are Going To Be Looking For Experience To Replace Commander-In-Chief Barack Obama.""(Morning Joe, ""Graham: I'll re-evaluate if I do poorly in NH,"" MSNBC, 10/16/15)""Our next president's greatest task is to undo the Obama Doctrine and reclaim our indispensable role as a force for global security. I am running for president because I am the only candidate with in-depth knowledge of these challenges and a detailed strategy for taking them on.""(Senator Lindsey Graham, ""Why We Need Troops On the Ground in Syria,"" IJReview, 10/15/15)CNN: ""GOP Presidential Candidates On Thursday Swiftly Criticized President Barack Obama's Decision To Delay The Withdrawal Of U.S. Troops In Afghanistan.""""GOP presidential candidates on Thursday swiftly criticized President Barack Obama's decision to delay the withdrawal of U.S. troops in Afghanistan, with several using the announcement to blast the commander-in-chief's leadership of the war since taking office...Also in a statement, South Carolina Sen. Lindsey Graham called Obama's decision one 'that will require our men and women in uniform to accept an incredibly high risk, with little support, simply because he's the president who promised to end wars.'"" (Heather Goldin, ""2016 GOPers sound off over Obama's Afghanistan decision,"" CNN, 10/15/15)Conway Daily Sun: ""After Giving A Speech Mostly About His Background And How He Would Put More Troops On The Ground To Fight ISIL...Graham Took Questions From The audience.""(Daymond Steer, ""Graham speaks his mind at Gibson Center,"" Conway Daily Sun, 10/15/15)Until Next Time, New Hampshire! "
Lindsey Graham,R,p,"October 19, 2015",Press Release - Graham Discusses National Security With Bill Hemmer On FOX News' America's Newsroom,"Graham: ""[As President,] I Would Have Gone Into Afghanistan. I Would Go Into Syria And Destroy ISIL In Iraq And Syria.""(America's Newsroom, ""Graham: Trump, Carson don't understand the war on terror,"" FOX News, 10/19/15)Alexandria, VA  This morning, Senator Lindsey Graham joined Bill Hemmer on Fox News' America's Newsroom to discuss national security and the incoherent foreign policy 'plans' of Ben Carson and Donald Trump. In case you missed it, watch the full interview here.Graham: ""If You Don't Take The Taliban Down After 9/11, Then You Don't Understand The War...Trump And Carson Both Said They Would Not Have Gone Into Afghanistan After 9/11.""""At the end of the day, I don't blame George W. Bush. But I would ask both of our front-runners to sit down with General Keane, General Petraeus and others and get a briefing about how the world actually works...""If you don't understand we don't have enough troops to change the tide of battle in Iraq, you're not ready for this job. So at the end of the day, none of our candidates are making a whole lot of sense to me.""(America's Newsroom, ""Graham: Trump, Carson don't understand the war on terror,"" FOX News, 10/19/15)"
