Candidate,Party,Type,Date,Title,Speech
Lindsey Graham,R,p,"June 1, 2015","""I'm Running!"": Initial Email Sent by Lindsey Graham Announcing His Campaign for President","Just moments ago I officially announced that I am running for the Republican nomination for President of the United States.Will you stand with me today as a DAY ONE Founding Member of my campaign? Please follow this link to make an instant online contribution.I did not make this decision lightly. After months of consideration and years of working to protect and secure our country, I knew I could still do more.Our country very much needs a proven leader...Who is ready to be Commander in Chief on Day One and has the conviction to defeat our enemies...Who can inspire Americans to build on the best our country has to offer...And who can cast a vision for a strong, secure and prosperous nation that Americans can rally around and give their full support.The greatest issue America faces is the growing threat to our nation's security from terrorist organizations with more capabilities, more arms, more recruits and more safe havens to attack the U.S. than at any time before 9/11.I recently retired as a Colonel from the U.S. Air Force Reserves after a 33-year career in the Air Force, National Guard and Reserves. I've visited and served in Afghanistan and the Middle East more than 20 times gaining first-hand knowledge about terror groups that threaten our way of life.I have the understanding, experience and leadership that is needed to protect this country. If you agree that we need an experienced leader in the White House, then I hope you will stand with me today by making a Day One supporter donation.I'm running for President to do the big things. I believe in the near future our great country is going to face tremendous challenges  both at home and abroad  and we are going to need proven leadership to meet those challenges.I have a proven conservative record of getting things done and bringing common-sense solutions to the table. I've been in the middle of debates, confrontations and decision-making on the critical issues  taxes, job creation, debt, Social Security, energy, military spending and foreign policy.More than anything, our nation needs a president who will make the tough decisions needed to keep us safe and carry on the great promise of America.I am hoping that today I can count on you to become a Day One Founding Member of my presidential campaign.The road ahead will not be easy, but I take comfort knowing I have your friendship and support.Sincerely,Lindsey GrahamP.S. I am 100% committed to becoming the Republican nominee for president and going one-on-one against Hillary Clinton next year. I promise a hard-hitting, honest and winning fight, but I need your immediate help to ensure we have the funds needed to do so. Please send whatever you can afford today. Thanks, Lindsey"
Lindsey Graham,R,p,"June 4, 2015",Press Release - Lindsey Graham Announces More Than 100 Members of South Carolina Finance Committee,"One day after launching his campaign for president in the 2016 election, Senator Lindsey Graham released the names of his South Carolina Finance Committee, which includes more than 100 top business and community leaders from across the Palmetto State.""This list is a Who's Who' in the South Carolina business and professional community,"" said Graham's Finance Committee Chairman David Wilkins, former U.S. Ambassador to Canada. ""There has never been a more impressive Finance Committee for a presidential campaign in South Carolina. Bringing this group together is a remarkable statement about how much these top leaders respect and support Lindsey Graham and the unique qualifications he brings to this presidential race.""Graham's S.C. finance committee includes top fundraisers for numerous campaigns going back nearly 20 years, including top finance leaders for Bush for President, McCain for President, Romney for President, DeMint for Senate, Sanford for Governor and Haley for Governor.""The members of our team know that Lindsey Graham is a leading voice on national security and foreign policy,"" Wilkins said. ""We are living in a very dangerous world, and Lindsey Graham is ready to serve as Commander in Chief on Day One.""Anita Zucker, CEO of the InterTech Group and co-chair of Graham's finance committee added her reasons for backing Graham. ""Our nation needs a president with the courage to take action on the most difficult issues facing America,"" Zucker said. ""Lindsey Graham embodies the governing qualities we need to put our country back on the right path.""In releasing the names of his S.C. finance team, Lindsey Graham expressed his personal gratitude. ""I'm deeply honored to have the support of all these major job creators and community leaders from across South Carolina,"" Graham said. ""This team has delivered for past Republican presidential nominees, and I appreciate their tremendous efforts as we launch this new campaign for America's future.""The members of Lindsey Graham 2016's South Carolina Finance Committee are:South Carolina ChairmanDavid H. Wilkins of Greenville, Partner at Nelson Mullins Riley & Scarborough. Former U.S. Ambassador to Canada and former SC Speaker of the House of Representatives. Haley for Governor Finance Committee 2014. DeMint for Senate Finance Co-Chair 2010. Bush campaign South Carolina Chairman 2004. Bush campaign South Carolina Co-Chair 2000. Thurmond for Senate Campaign Chairman 1996.South Carolina Co-ChairsTerry S. Brown of Columbia, Real Estate Executive. Romney Finance Committee 2012. McCain Finance Committee 2008. SC GOP Victory 2008 Finance Co-Chair.Wallace Cheves of Greenville, Managing Partner of Sky Boat Gaming.E. Bart Daniel of Charleston, Self-Employed Attorney. Romney Finance Committee 2012. McCain Finance Committee 2008. DeMint for Senate Finance Committee Co-Chair 2004. Bush Finance Committee 2000. Former U.S. Attorney for South Carolina.C. Edward Floyd, Jr. of Florence, Surgeon with Floyd Medical Associates. Haley for Governor Finance Committee 2014. McCain Finance Committee 2008. Sanford for Governor Finance Committee Co-Chair 2006. DeMint for Senate Finance Team Co-Chair 2004. Bush Ranger and South Carolina Finance Co-Chair in 2004. Bush Pioneer and Finance Committee 2000.George D. Johnson, Jr. of Spartanburg, Chairman of Johnson Development, Inc. McCain Finance Committee 2008. DeMint for Senate Finance Committee 2004. Bush Pioneer in 2000 and 2004.E. Smyth McKissick, III of Greenville, Chairman and CEO of Alice Manufacturing Company. Haley for Governor Finance Committee 2014. Romney Finance Committee 2012.Robert V. Royall of Mount Pleasant, Former U.S. Ambassador to Tanzania, Former SC Secretary of Commerce and retired banking executive. McCain Finance Committee 2008. Bush Finance Committee Chairman 2000. SC GOP Victory 2000 Finance Chairman.Bill H. Stern of Columbia, President of Stern & Stern Commercial Developers, Chairman of the Board of SC Ports Authority. McCain Finance Committee 2008. Sanford for Governor Finance Committee Chairman 2006. SC Inaugural Committee Chairman 2006.Joe E. Taylor of Columbia, CEO of Southland Capital Partners. Former SC Secretary of Commerce.Douglas P. Wendel of Myrtle Beach, Business Consultant and former Real Estate Executive. McCain Finance Committee 2008. Bush Finance Committee 2000.Thad H. Westbrook of Lexington, Attorney at Nelson Mullins Riley & Scarborough. Wilson for Attorney General 2010 Campaign Chairman.John B. White, Jr. of Landrum, Attorney at Harrison, White, Smith, & Coggins. Scott for Senate Finance Committee 2014. McMaster for Lieutenant Governor Finance Committee 2014. McCain Finance Committee 2008. Bush Finance Committee 2004. Bush Finance Committee 2000.Anita G. Zucker of Charleston, Chair and CEO of The InterTech Group. Scott for Senate Finance Committee 2014. Romney Finance Committee 2012.South Carolina MembersC. Dan Adams of Greenville, President and CEO of The Capital Corporation. Haley for Governor Finance Committee 2014.James W. Apple, Jr. of Myrtle Beach, President and CEO of Burroughs & Chapin Inc.Vic Bailey, III of Spartanburg, President of Vic Bailey Automotive Superstore.Tommy B. Baker of Charleston, Owner and President of Baker Motor Company.J. Edward Bell, III of Georgetown, Founding Partner at Bell Legal Group.William H. Best of Columbia, Founder of Thermal Engineering Corp.Ann W. Bible of Greenville, Senior Counsel of Gear Solar. Bush Task Force 2004.William S. Biggs of Anderson, President and COO of HMR Veterans Services, Inc. Romney Finance Committee 2012.Kathy Bigham of Rock Hill, former Restauranteur.Larry S. Bowman of Seneca, Surgeon and Founder of Blue Ridge Orthopedics.Rigdon H. Boykin of Rembert, General Manager of Green Energy Holdings, LLC.Mike Brenan of Columbia, South Carolina President of BB&T.; Haley for Governor Finance Committee 2014.W. Lee Bussell of Chapin, CEO of Chernoff Newman.Mark W. Buyck, Jr. of Florence, Attorney at Willcox Law Firm. McCain Finance Committee 2008. Co-Chairman of DeMint for Senate Finance Committee 2004. Former U.S. Attorney for South Carolina.John T. Cahill of Charleston, Chairman and CEO of Kraft Foods, Inc.David R. Campbell of Columbia, President & COO of Chernoff Newman.Mary Anne Cannady of Walterboro, Chairman of Cannady Agency Inc.W.T. Cassels, Jr. of Columbia, Chairman of Southeastern Freight Lines. Bush Finance Committee 2004. Bush Finance Committee 2000.W. Tobin Cassels, III of Columbia, President of Southeastern Freight Lines.Robert H. Chapman, III of Inman, Chairman, CEO and Treasurer of Inman Mills.Robert L. Clement, IIIof Charleston, Real Estate Development at Clement, Crawford & Thornhill.William A. Coates of Greenville, Attorney at Roe Cassidy Coates & Price PA.Lloyd W. Coppedge of Myrtle Beach, Chairman of the Professional Plumbing Group, Inc., Former President and CEO of Wolverine Brass, Inc., and Former President and CEO of Plumbmaster, Inc.Charles E. Dalton of Greenville, President of Blue Ridge Electric Cooperative.Tony Denny of Lexington, President of Denny Public Affairs. Former Executive Director of the State Republican Party.R. Scott Dover of Pickens, Self-Employed Attorney.Dennis E. Drew of Mount Pleasant, Owner and CEO of Convergent 3D.David E. Dukes of Columbia, Partner at Nelson Mullins Riley & Scarborough.Bill Dukes of Chapin, Restaurateur, Blue Marlin Restaurant.Joe A. Edens of Columbia, Chairman of the Board of EDENS. McCain Finance Committee 2008. Bush Finance Committee 2004. Bush Finance Committee 2000.Rick F. Elliott of North Myrtle Beach, President of Elliott Realty.Carl O. Falk of Pawleys Island, Board of Directors, Falk-Griffin Foundation.Marcia G. Falk of Pawleys Island, Board of Directors, Falk-Griffin Foundation.Ronald H. Fielding of Kiawah Island. Board Member, ICI Mutual Insurance, Saturna Investment Trust, and the Amana Funds.James Galyeanof Greenville, Attorney at Nexsen Pruet.Jimmy I. Gibbs of Spartanburg, President & CEO of Gibbs International.Joseph P. Griffith, Jr. of Mount Pleasant, Self-Employed Attorney. Romney Finance Committee 2012. McCain Finance Committee 2008.John A. Hagins, Jr. of Greenville, Attorney at Covington Patrick Hagins Lewis.M. Brian Hall, III of Clover, President of ML Ford and Sons, Inc.Steven W. Hamm of Columbia, Shareholder at Richardson, Plowden & Robinson.John R. Hamrick of Seneca, Real Estate Developer at Hamrick Real Estate.Benjy A. Hardee of Little River, President of A.O. Hardee & Son, Inc.John M. S. Hoefer of Columbia, Attorney at Willoughby and Hoefer PA.Hal B. Holmes, Jr. of Conway, Physician.Tee Hooper, Jr. of Greenville, CEO of General Wholesale Distributors.Matthew R. Hubbell of Charleston, Self-Employed Attorney. Romney Finance Committee 2012. McCain Finance Committee 2008.Harry Huge of Charleston, Self-Employed Attorney. Co-Founder of the Harry and Reba Huge Foundation.Robert E. Hughes, Jr. of Greenville, President of Hughes Development Corp.Stephen A. Imbeau of Florence, Physician with Allergy, Asthma & Sinus Center. McCain Finance Committee 2008. Sanford for Governor Finance Committee 2004.Stewart H. Johnson of Spartanburg, CEO of Morgan Corp.Ned W. Johnson, II of Columbia, Attorney at McNair Law Firm. McCain Finance Committee 2008. Co-Chairman of Dole for President 1988.George Dean Johnson, III of Spartanburg, CEO of Johnson Development, Inc.William W. Jones, Jr. of Bluffton, Attorney at Jones, Simpson and Newton.Ginger Keating of Charleston.Mark B. Kent of Greenville, President and CEO of Kent Holdings.Jerry Kline of Columbia, President of Kline Iron & Steel.Robert A. Knight of Greenville, President and Owner of Public Strategy, LLC.Mark Lazarus of Myrtle Beach, Owner of Wild Water & Wheels. Horry County Council Chairman.Jim Lehman of Columbia, Managing Partner at Nelson Mullins Riley & Scarborough.Louis B. Lynn of Columbia, Owner of Enviro AgScience, Inc.Larry A. McKinney of Greenville, Co-Founder of Eldeco Inc.Earl E. McLeod, Jr. of Lexington, Executive Director, Building Industry Association of Central, SC.W. Scott Montgomery, IV of Spartanburg, Principal at RePower South.James C. Morton, Jr. of Greenville.George B. Nalley, Jr. of Easley, Real Estate Developer at Nalley Commercial Properties, LLC.John L. Napier of Pawleys Island, Self-Employed Attorney. Former SC Congressman. Former Federal Judge. McCain Finance Committee 2008. Campbell for Governor 1990 Campaign Co-Chair. Reagan for President 1984 SC Co-Chair.Timothy Norwood of Florence, Vice President of Sales and Global Sales Manager for ADP Tax Credit Services.David S. Pankau of Columbia, President and CEO of Blue Cross and Blue Shield of South Carolina.G. Mark Phillips of Charleston, Attorney at Nelson Mullins Riley & Scarborough.David J. Posek of Pawleys Island, President of Daedalus Management Solutions. Romney Finance Committee 2012.A. Marvin Quattlebaum, Jr. of Greenville, Attorney at Nelson Mullins Riley & Scarborough.Terry E. Richardson, Jr. of Barnwell, Attorney at Richardson, Patrick, Westbrook & Brickman.Neil C. Robinson, Jr. of Charleston, Attorney at Nexsen Pruet. Reagan for President Finance Committee.James W. Roquemore of Cameron, CEO of Patten Seed Company. McCain Finance Committee 2008.Charles C. Rountree, III of Columbia, Executive at The Rountree Group.Minor M. Shaw of Greenville, President of Micco, LLC.John S. Simmons of Columbia, Attorney at Simmons Law Firm. Former U.S. Attorney for South Carolina.Danny R. Smith of Pauline, Attorney at Harrison, White, Smith, & Coggins. Former Spartanburg County Council Member.Doug Smith of Spartanburg, Attorney at Johnson, Smith, Hibbard & Wildman. Former Speaker Pro Tempore of the SC House of Representatives.Lewis T. Smoak of Greenville, Attorney at Ogletree, Deakins, Nash, Smoak & Stewart.L. Stewart Spinks of Greenville, Chairman and Founder of Spinx Co. McCain Finance Committee 2008. DeMint for Senate Finance Team 2004.Joseph P. Strom of Columbia, Managing Partner at Strom Law Firm, LLC. Former U.S. Attorney for South Carolina.Henry McCall Swink of Effingham, Owner of McCall Farms.Lonnie F. Thompson of Florence, President of Sopakco.O.L. Thompson, IIIof Charleston, CEO of O.L. Thompson Construction Co., Inc.David J. Tigges of Hilton Head, CEO of McNair Law Firm, PA. Haley for Governor Finance Committee 2014.Jason Tompkins of Columbia, Real Estate Executive.Joseph J. Turner, Jr. of Clemson, CEO of First Sun Management Corporation.Manuel R. Vallarino of Surfside Beach, President of Vallarino Construction, LLC. Haley for Governor Finance Committee 2014. McMaster for Lt. Governor Finance Committee 2014.Charles S. Way, Jr. of Charleston, Chairman of the Board of The Beach Company. Former SC Secretary of Commerce.William M. Webster, IV of Spartanburg, Co-Founder and Chairman of Advance America.Edward J. Westbrook of Mount Pleasant, Attorney at Richardson, Patrick, Westbrook & Brickman.Mack I. Whittle, Jr. of Greenville, Former President and CEO of The South Financial Group. McCain Finance Committee 2008.Richard N. Wilkerson of Greenville, Chairman and Retired President of Michelin North America.W. Walt Wilkins, III of Greenville, 13th Judicial Circuit Solicitor. Former U.S. Attorney for South Carolina. Bush Finance Committee 2004.Robert Wilkins of Greenville, Attorney at Wilkins & Bouton, LLC.William W. Wilkins of Greenville, Attorney at Nexsen Pruet. Former Chief Judge of the Fourth Circuit Court of Appeals.Kathryn Williams of Greenville, Attorney at Law. Thurmond for Senate Finance Committee. Bush for President Finance Committee 1992.George B. Wolfe of Columbia, Partner at Nelson Mullins Riley & Scarborough. McCain Finance Committee 2008. Bush Finance Committee 2000. SC GOP Victory Finance Chairman 1998.J. Michael Wooten of Myrtle Beach, President of DDC Engineers, Inc.Weldon Wyatt of Graniteville, Owner of Sage Valley Golf Club.James C. Yahnis of Murrells Inlet, Co-Owner of The Yahnis Company.Monica Zielinski of Clemson, Former Real Estate Agent of Carolina Real Estate."
Lindsey Graham,R,p,"June 4, 2015",Press Release - Lindsey Graham 2016 Announces National Finance Committee,"Alexandria, VA  Lindsey Graham 2016 today announced its National Finance Committeefollowing the campaign's official launch on Monday, June 1.""Only Lindsey Graham has shown he has the ability and commitment to provide the kind ofleadership that will allow us to overcome our nation's challenges. He understands thatAmerica has an indispensable role to play in creating the stability and building theinstitutional capacity that are essential for growing marketsand abiding security,"" said JeffImmelt, Chairman and CEO of General Electric.""Lindsey Graham understands America's leadership role in promotingan enduring peace onthe global landscape. With conflicts raging in the Middle East and around the world thatthreaten the security of America and our allies, we need leaders with strategic purpose andmoral clarity to confront these crises,"" said Ronald O. Perelman, Chairman and CEO ofMacAndrews & Forbes Incorporated.Please find the list of Lindsey Graham 2016's National Finance Committee below:National Finance ChairmanDavid H. Wilkins, Partner, Nelson Mullins Riley & Scarborough and former U.S.Ambassador to CanadaNational Co-ChairsSafra A. Catz, CEO, Oracle CorporationJeff Immelt, Chairman & CEO, General ElectricBarry Mannis, Managing Member, Samuel Capital Management, LLCRonald O. Perelman, Chairman & CEO, MacAndrews & Forbes IncorporatedBobby Rechnitz, Chairman, Iron Dome TributeMichael Steinhardt, Steinhardt ManagementAnita G. Zucker, CEO, InterTech GroupNortheastBradley Bloom, Managing Director, Berkshire PartnersRichard Chilton, CEO, Chilton Investment CompanyMichael K. Crossen, Partner, Rubin and Rudman LLPTed Cutler, Chairman, The Interface GroupAlec Ellison, Investment Banker, Jefferies & Co.David Flaum, CEO, Flaum Management Company, Inc.Tom Joyce, Chairman, Arxis Capital InvestmentsPeter Malone, Operating Executive, The Carlyle GroupOswaldo ""Ozzie"" Palomo, Senior Vice President, A.D.S VenturesMark Rubin, M.D., Massachusetts General HospitalSoutheastTerry S. Brown, Real Estate ExecutiveWallace Cheves, Managing Partner, Sky Boat GamingE. Bart Daniel, AttorneyC. Edward Floyd, Jr., Surgeon, Floyd Medical AssociatesRobert E. Hobart, President & CEO, Hobart VenturesGeorge D. Johnson, Jr., Chairman, Johnson DevelopmentE. Smyth McKissick, III, CEO, Alice Manufacturing CompanyFrank Risch, Board Director, Pioneer Natural Resources Co.William Rosenberg, M.D., Cabarrus Family MedicineRobert V. Royall, former U.S. Ambassador to TanzaniaRoger Sofer, Partner, Sofer Steiner and AssociatesBill H. Stern, President, Stern & Stern Commercial DevelopersJudy & Sidney Swartz, former Chairman, The Timberland CompanyJoe E. Taylor, CEO, Southland Capital PartnersDouglas P. Wendel, Business ConsultantThad H. Westbrook, Partner, Nelson Mullins Riley & ScarboroughJohn B. White, Jr., Harrison, White, Smith & CogginsWestYitz Applbaum, Co-Founder, Falcon PartnerRichard & Leslie Frank, Frank Family VineyardsRon Simms, President, Simms Commercial Development"
Lindsey Graham,R,p,"June 4, 2015",Press Release - An American Upbringing," ""Now He's Ready To Take Those Leadership Skills To The White House"" Following today's announcement of his presidential campaign, Senator Lindsey Graham released the following web video, entitled ""An American Upbringing."" The video highlights his life experiences, expertise in foreign policy and describes how his background makes him uniquely qualified to be Commander-in-Chief on day one.VIDEO SCRIPT:""Some men are born leaders, others are tested, refined and forged through life's experiences.""Lindsey Graham is both.""Lindsey was born the son of a blue-collar family in the small town of Central in upstate South Carolina. His parents worked long hours to eke out a modest living running a tiny restaurant and liquor store.""From a young age, Lindsey learned about hard work and the value of a dollar. Like small business owners everywhere, if Lindsey's parents didn't open the doors each day, they didn't get paid  there were no sick days, and very few vacations. It was here that Lindsey learned to pull his own weight - both by helping with the business, and helping raise his younger sister, Darline.""Lindsey Graham was the first in his family to go to college. But, while attending the University of South Carolina, both of his parents tragically passed away.""While most young men his age were enjoying campus life, Lindsey took on the added responsibility of traveling home weekends to work in the family business and help care for Darline. With his parents gone, Lindsey was committed to providing for his sister. He took that commitment a step further by legally adopting her when she was in high school and with the help of a loving aunt and uncle, Lindsey made sure she not only finished high school but earned her college degree.""Despite these challenges and adversity, the work ethic he learned from his parents paid off; Lindsey graduated from USC with both a bachelor and law degree.""Following law school, Graham joined the Air Force. After 6 and a half years on active duty as a JAG officer, he joined the South Carolina Air National Guard and served stateside during the first Gulf War. Graham wore the uniform for 33 years, retiring this year as a Colonel with the Air Force Reserves.""First elected to the House of Representatives in 1994 and the Senate in 2002, Lindsey Graham has become the go-to-guy on Capitol Hill for national security and foreign policy issues, in part because of his military experience.""He has served as a reserve duty officer in Iraq and Afghanistan and has been to the Middle East more than 20 times, gaining first-hand knowledge about ISIS, the Taliban and other terror groups that threaten our way of life.""Because of his expertise on foreign policy issues, Lindsey Graham has been an outspoken critic of President Obama's failed foreign policy. His knowledge and experience makes him uniquely qualified to correct the mistakes of the past while providing the steady leadership and decision-making skills we need to keep America safe.""A respected problem solver, Lindsey Graham is a true conservative who's willing to tackle any issue head on - whether it's fighting for the American taxpayer or protecting and defending our constitutional rights.""Blue-collar upbringing, tireless work ethic, allegiance to family values, and a lifetime of military service, Lindsey Graham has lived the American dream - from sleeping in the backroom of a tiny restaurant to becoming a respected leader in the United States Senate. Now he is ready to take those leadership skills to the White House, to restore faith in America's exceptionalism, and our belief that the United States is still the leader... and best hope... for a free and safe world."""
Lindsey Graham,R,p,"June 5, 2015",Press Release - Senator Lindsey Graham To Deliver Remarks At The Upstate Chamber Coalition Presidential Series,"Following last week's announcement of Senator Lindsey Graham's presidential campaign, Lindsey Graham 2016 today announced that Graham will deliver remarks to the Upstate Chamber Coalition Presidential Series on Monday, June 8th in Greenville, SC. Senator Graham's remarks will come directly after a week-long announcement tour where he attended events throughout New Hampshire and Iowa.MONDAY, JUNE 8WHO: Senator Lindsey GrahamWHAT: Remarks at the Upstate Chamber Coalition Presidential SeriesWHEN: 11:30 a.m. ETWHERE: Marriott Greenville1 Parkway EastGreenville, SC*NOTE: Press who plan on attending should contact Jason Zacher of the Greenville Chamber of Commerce at jzacher@greenvillechamber.org or by phone at 864-239-3718 for credentials."
