Candidate,Party,Type,Date,Title,Speech
Lindsey Graham,R,p,"July 9, 2015","Press Release - Graham: ""As President of the United States, I Would Shape World Events Rather Than Being Overwhelmed by Them""","Alexandria, VA - Senator Lindsey Graham outlined his national security agenda yesterday as the inaugural guest at the Atlantic Council's series ""America's Role in the World"" in Washington, DC. Graham addressed a wide range of foreign policy issues, including the negotiations with Iran, defeating radical Islam, securing Afghanistan, driving out Assad, and stabilizing Syria.Senator Graham is the first 2016 presidential candidate to outline a comprehensive approach to national security.CLICK TO WATCH THE FULL VIDEO:On The Failed Policies Of President Obama And Hillary Clinton: ""President Obama's Foreign Policy Has Been A Disaster, And Former Secretary Of State Clinton Was One Of The Chief Architects""""As recently as Monday of this week, President Obama claimed that our strategy against ISIL is working and that we're more prepared to deal with major attacks against the homeland. In my view, the president constantly oversells our successes and minimizes the threats to our nation. There is no coherent strategy to degrade and destroy ISIL, and there are more radical Islamic groups with the capability and capacity and desire to strike our homeland than at any time since 9-11. Our defenses are being overwhelmed by the number of threats. And as the threats grow we continue to cut our budget and embrace strategies that are designed not to destroy ISIL but to pass this problem along to the next president. Simply put, President Obama's foreign policy has been a disaster, and former Secretary of State Hillary Clinton was one of its chief architects.""On His National Security Approach: ""Superior Capability, Overwhelming Capacity And, Most important Of All, Determined Will""""When it comes to foreign policy, Lindsey Graham offers a very clear and different path. The path that I embrace is going to be tough. But the outcome would ensure a safe America. The Obama-Clinton path has been one from leading from behind, hoping that threats would go away, claiming to have strategies to defeat and degrade ISIL that actually have no chance of working.""The foundation of my foreign policy would be as follows: Superior capability, overwhelming capacity and, most important of all, determined will. Without superior capability and overwhelming capacity, you invite aggression. And under the construct of sequestration, we're losing our capability and our capacity in hard and soft power. But without will, it's all talk.""On A Strategy To Degrade And Destroy ISIL: ""We Would Decapitate Their Leadership""""The strategy articulated by President Obama to degrade and destroy ISIL doesn't have a snowball's chance in hell of working. You have to look at Iraq and Syria as a single battle space... You will never bring stability to Iraq, unless you deal with the Syrian safe havens. The capital of the caliphate is in Syria, not Iraq. I believe that you must have strategy with a ground component beyond the Kurds to actually destroy the caliphate inside Syria.""We have 3,500 American forces within Iraq. Too few to do what we need to do. If I were President of the United States I would follow Jack Keane's advice and increase ground forces on the U.S. side inside of Iraq. We would go to approximately 10,000... There would be a Special Forces component. That Special Forces component would hunt the leadership of ISIL morning, noon, and night. Not just a single raid, but multiple raids. We would decapitate their leadership.""On A Good Deal With Iran: ""I Want A Deal, But I Want A Good Deal""""I want a deal, but I want a good deal. A bad deal would create a nuclear arms race in the Mid-East. What is a bad deal? A deal in the eyes of the Sunni Arabs that gives the Iranians too much capability, so they could no longer sit on the sidelines as Sunni Arabs and not get into the nuclear arena themselves.""If I were president, I would create an international inspection regime unlike anything you've ever seen. Anytime, anywhere would mean anytime, anywhere. I would not give them a dollar more of money until they change their behavior... the inspection regime would not end based on the passage of time, it would end based on the change in behavior.""On Winning The War On Terror: ""It's A Roaring Hot Fire Today, Radical Islam, My Goal Is To Make It An Ember""""What is winning in the war on terror? Winning to me is when radical Islam can be contained by the armies and police forces within the region where it arose. That they have the capability to keep it at bay to protect themselves and us.""It's a roaring hot fire today, radical Islam, my goal is to make it an ember... That's going to take, ladies and gentlemen, a generational commitment. A small schoolhouse in a remote region in Afghanistan...educating a young girl would do more damage to the Taliban than any bomb we could drop on their head.""On Iran's Nuclear Ambitions: ""The Most Existential Threat To World Order Is The Nuclear Ambitions Of The Iranians""""The most existential threat to world order is the nuclear ambitions of the Iranians. There are some things you can get wrong and live to fight anther day. There are some things you have to get right, because if you don't, you will throw the world into chaos that we haven't seen since World War II. ...the Iranian regime is not moderate.""As to the nuclear ambitions of the Iranians. If you want a peaceful nuclear power program, and I'm president, you can have it... If you want an enrichment program large in nature that will lead one day to a nuclear breakout, like North Korea, you will not have it. If you want a war, you will lose it.""On Assad And Syria: ""Assad Wouldn't Last Two Minutes Without Iranian Support""""Assad wouldn't last two minutes without Iranian support. If Syria continues the way it's going in the next year, I fear that Lebanon and Jordan will collapse...What happens if we continue on the same track? What are the consequences to the region, if Assad is still in power in January 2017? ""There are more Syrian children in Lebanese schools at the primary level, than there are Lebanese children. The King of Jordan is being overwhelmed by Syrian refugees. At the end of the day, if Syria is not addressed, it's going to take Lebanon and Jordan down with it.""On Embracing Dictatorships: ""And As We Confront Dictators, The Worst Possible Thing You Can Do Is Draw A Red Line, They Cross It And Nothing Happens""""President Obama, I think, has blinked in the face of many challenges. The Arab Spring is still alive and well. The Arab Spring is a desire by women, young people and the disenfranchised to live a better life...So to anybody who wants to be President of the United States and embraces bringing back dictators, I think you've made two fundamental mistakes. One, you don't realize who we are as a nation. And number two, you don't understand what's going on in the world, especially in the Middle East...Young people, women and the disenfranchised will not live in dictatorships for our convenience any longer...""And as we confront dictators, the worst possible thing you can do is draw a red line, they cross it and nothing happens.""On The Primary Job Of The President Of The United States, Graham: ""President Of The United States' Primary Job... Is To Be Commander-In-Chief""""Number one. President of the United States' primary job, I think, is to be Commander-in-Chief. It's the most important job any president has to perform and we spend precious little time talking about it...We move from one outrageous topic to the other and it's pretty hard to focus on national security at a time when we should, so thank God that there's a place like the Atlantic Council.""On Being President Of The United States: ""I Would Shape World Events Rather Than Being Overwhelmed By Them""""As President of the United States, I would shape world events rather than being overwhelmed by them...I believe radical Islam in terms of what they want to do. I reject what they want to do. And as President of the United States, I will empower others to stop them... When it comes to being Commander-in-Chief, whatever it takes, as long as it takes."""
Lindsey Graham,R,p,"July 9, 2015",Press Release - Daily Caller: Lindsey Graham Attacks Rand Paul In Foreign Policy Address,"Lindsey Graham Attacks Rand Paul In Foreign Policy Address By Jamie WeinsteinJuly 8, 2015South Carolina Sen. Lindsey Graham came out swinging against Rand Paul in a wide-ranging foreign policy address Wednesday morning....""To those on the Republican side who want us to become fortress America, I'm your worst choice,"" Graham said. ""To my friend Rand Paul, we agree on a lot but on this we disagree: He is the one voice in the Republican Party that I think has been weaker on national security than that of President Obama.""Turning to the current negotiations to get a nuclear deal with Iran, Graham said that President Barack Obama won't get a good deal because he is ""viewed as weak"" by the Iranians and ""uncertain"" by America's allies. Graham then hit Paul once again.""I think everybody running except Rand Paul could get a better deal with the Iranians,"" he said....Read Full Story Here"
Lindsey Graham,R,p,"July 9, 2015",Press Release - Greenville News: Graham Sounds Bellicose Note in Foreign Policy Speech,"Graham sounds bellicose note in foreign policy speechBy Mary TroyanJuly 8, 2015WASHINGTON - Sen. Lindsey Graham said Wednesday that, if elected president, he would deploy 16,500 more American troops to Iraq and Syria, retain the 9,800 already in Afghanistan, and consider adding as many more as required to defeat terrorists or prevent a nuclear catastrophe.The South Carolina Republican, hoping to stand out among the crowded field of GOP presidential candidates, delivered a blistering foreign policy speech to the Atlantic Council in Washington that added detail  along with a distinct sense of alarm and urgency  to his previously stated policy positions.Graham also said he would attack Iran's infrastructure, navy and air force to keep the country from acquiring a nuclear weapon.""It's not because I like war or want war,"" Graham said. ""It's because I want to defend a nation.""Even before Wednesday's speech, Graham was identified as the most hawkish of the 14 Republicans who have officially entered the 2016 presidential race. On Wednesday, he dismissed critics who call him a war-monger, and told voters who are tired of war to vote for someone else.Radical Islam, he said, is a ""roaring hot fire"" and ""my goal is to make it an ember, and that is going to take a generational commitment."" Republican candidates who oppose sending more troops to Iraq or making open-ended commitments to a military presence in the Middle East are showing weakness, he said....Read Full Story Here"
Lindsey Graham,R,p,"July 9, 2015",Press Release - Bloomberg: Lindsey Graham: 'Somebody Needs to Take the Shovel Out of Donald Trump's Hands',"Lindsey Graham: 'Somebody Needs to Take the Shovel Out of Donald Trump's Hands'By Ben BrodyJuly 8, 2015...""The first rule of politics when you're in a hole is stop digging,"" Graham, a South Carolina senator, said at an Atlantic Council event in Washington. ""I think somebody needs to take the shovel out of Donald Trump's hands.""...""I don't need a lecture from Donald Trump on border security,"" Graham said. ""Stop yelling about it and get Democrats and Republicans to work together.""""Why would any group listen to your economic plan if you're going to deport their grandmother?"" he said.Graham also knocked Democratic front-runner Hillary Clinton, who told CNN Tuesday that Republicans ""range across a spectrum of being either grudgingly welcome or hostile towards immigrants"" and chided the party for not going farther to denounce Trump.Clinton, who served as secretary of state from 2009 to 2013 after eight years in the Senate, laid out a sweeping immigration platform in May including a ""full and equal"" path to citizenship for undocumented immigrants.""Hillary Clinton never lifted a finger,"" said Graham of her time as the nation's top diplomat. ""I been in every gang you can be in in the Senate. If we had tattoos, I'd have an armful. I don't remember seeing her once.""Read Full Story Here"
Lindsey Graham,R,p,"July 9, 2015",Press Release - Wall Street Journal: Lindsey Graham: Tell Hillary Clinton I Also Back Pathway to Citizenship,"Lindsey Graham: Tell Hillary Clinton I Also Back Pathway to CitizenshipBy Reid EpsteinJuly 8, 2015Democratic presidential front-runner Hillary Clinton said on Tuesday the entire 2016 GOP presidential field opposed a pathway to citizenship for undocumented immigrants. Not so, cried South Carolina Republican Sen. Lindsey Graham.On Wednesday, Mr. Graham said he still backs the 2013 Senate immigration bill he helped pass, which included a path to citizenship, enhanced border security, and other measures. It died in the Republican-led House of Representatives.Then Mr. Graham added an unsolicited shot at fellow Republican Donald Trump.""I'm for a pathway to citizenship,"" Mr. Graham said in an interview with Wall Street Journal reporters and editors. ""What she's trying to do is cast us in an extreme light. Between her and Donald Trump, Donald Trump's doing more to hurt us than she is.""...Mr. Graham, one of eight senators who authored the 2013 legislation, warned that Republicans risk further alienating Hispanic voters if they don't disavow Mr. Trump's statement on immigration. He was tougher on Mr. Trump than was Mrs. Clinton, who merely called his remarks ""disappointing.""""That is offensive, that is not accurate,"" he said. ""The overwhelming majority of the 11-plus million illegal immigrants are good, hardworking people who need to get right with the law, among them are some really bad people, rapists, drug dealers and killers.""...Read Full Story Here"
Lindsey Graham,R,p,"July 9, 2015",Press Release - Wall Street Journal: Lindsey Graham: Obama Will Never Strike a Satisfactory Iran Nuclear Talks Deal,"Lindsey Graham: Obama Will Never Strike a Satisfactory Iran Nuclear Talks DealBy Reid EpsteinJuly 8, 2015Sen. Lindsey Graham said Wednesday that President Barack Obama will never achieve a satisfactory nuclear deal with Iran and that the best outcome for the U.S. would be for the negotiations with the Middle Eastern power to drag out until the next president is in office.In an interview with Wall Street Journal reporters and editors, the South Carolina Republican said every 2016 Republican presidential candidate save Sen. Rand Paul - and even leading Democrat Hillary Clinton too - would strike a better deal with Iran than would Mr. Obama....On how he differs from leading Republican presidential candidates on Iran and Middle East policy""I really don't know exactly where everybody's at. [Wisconsin Gov.] Scott Walker, I don't know where he's at. He said he's not going to be for an open-ended commitment when it comes to sending troops. Well, I am. My policy toward radical Islam is pretty simple: Whatever it takes, as long as it takes until we defeat them. So when he says he's not for an open-ended commitment I don't know what that means. It means he's hesitant. I'm not.""When it comes to Syria, Jeb and Marco and all these guys need to step up. What are you going to do? Are you going to impose a no-fly zone? I would do it the first day on the job. Assad's going to go standing up or sitting down. Because you can't fix Syria and the Mid-East until you fix Syria. So I would put on the table American troops would go in with Arab armies. The bulk of the force would be the Turks, the Egyptians, the Saudis and others in the region. You're talking about 30 to 40,000, at least, [ISLAMIC STATE] guys in Syria, it's going to take a big army to pull them up. We'd probably need around 10,000 of our guys and 70 or 80,000 of their guys to go in and have a decisive edge over [ISLAMIC STATE].""Read Full Story Here"
Lindsey Graham,R,p,"July 9, 2015","Press Release - Washington Examiner: Lindsey Graham: I Don't Need 'Lecture' from Hillary, Trump on Immigration","Lindsey Graham: I don't need 'lecture' from Hillary, Trump on immigrationBy David SherfinskiJuly 8, 2015Sen. Lindsey Graham of South Carolina on Wednesday ripped Democrats and Republicans alike on the issue of immigration, saying he doesn't need a lecture on the issue from former secretary of state and 2016 Democratic presidential front-runner Hillary Rodham Clinton or real estate mogul Donald Trump.Mr. Graham pointed out that in 2009, President Obama had 60 Democratic senators, a big majority in the U.S. House, and that the president had campaigned on the issue of immigration reform.""He didn't do a damn thing, and Hillary Clinton never lifted a finger,"" said Mr. Graham, a 2016 GOP presidential candidate. ""I want to remind everybody who cares about immigration reform that Obamacare, Dodd-Frank and the stimulus went ahead of you.""Mr. Graham was discussing the issue during a question-and-answer session after an address on foreign policy at the Atlantic Council in D.C. In an interview that aired this week on CNN, Mrs. Clinton had said Republicans ""range across a spectrum of being either grudgingly welcome or hostile toward immigrants.""""I don't need a lecture from Hillary Clinton about immigration reform  I've been in every gang you could be in in the Senate,"" said Mr. Graham, who most recently helped author the comprehensive ""Gang of Eight"" immigration bill that passed the Senate in 2013. ""If we had tattoos, I'd have an armful. I don't remember seeing her once ... she never came to any meetings I was at. She was a public voice in 2009; I never remember her saying 'wait a minute, President Obama  you promised to do immigration reform. Honor your promise.' She didn't say a word....He noted that he lost his mother at the age of 21 and his father at the age of 22.""My sister was 13,"" he said. ""If it wasn't for family, friends and faith I would not be sitting here. I am not going to engage in rhetoric or policies to destroy a family that's done nothing more than try to get a better life for my political"" gain.""So Hillary Clinton, you had a chance to push President Obama in 2009 and you were completely AWOL. I don't need a lecture from you about illegal immigration,"" he said. ""I don't need a statement from Donald Trump that the border's broken  I know it. And when it comes to casting a shadow over all these people, to put them in the group of being rapists and drug dealers  not only is it wrong, you're digging a bigger hole and I hope every Republican candidate would say the following: we disagree with Donald Trump in this regard, that most of the people here illegally are good, hardworking people, and if we're not willing to say that as a party, we're gonna lose in 2016.""Read Full Story Here"
Lindsey Graham,R,p,"July 9, 2015",Press Release - Washington Free Beacon: Lindsey Graham Shuts Down Code Pink Protester,"Lindsey Graham Shuts Down Code Pink ProtesterBy Daniel BassaliJuly 8, 2015 Patiently waiting for Medea Benjamin to finish her rant, Sen. Lindsey Graham (R., S.C.) refused to fall victim to typical Code Pink rabble-rousing on Wednesday when discussing foreign policy at an Atlantic Council event.Graham was being interviewed by CNN's Jake Tapper when Benjamin, co-founder of Code Pink, grabbed the microphone to protest Graham's hawkish views on the Middle East. She began with the inflammatory accusation that Graham intentionally wanted to keep American soldiers in harms way with endless war....The persistent agitator refused to stop speaking. Her actions received groans and outright boos from an audience apparently upset that one protester hijacked the event. Benjamin told the audience to be quiet, saying ""Shh. Be respectful of me.""""So I'm going to put her down as undecided,"" Graham quipped.Then, BEASTMODE.""I couldn't disagree with you more,"" Graham told Benjamin. ""I think people like you make the world incredibly dangerous. I think people like you are radical Islam's best hope.""Graham explained the fight against radical Islam began without a soldier in Afghanistan. He offered his point of view on the subjects Benjamin brought up, refuting her assertions.""At the end of the day, ladies and gentlemen, we are in a religious war,"" Graham said. ""I didn't start this war but somebody's got to end it.""The Washington Free Beacon could not determine whether Code Pink plans to interrupt Hillary Clinton campaign events due to her vote for the Iraq War. Read Full Story Here"
