Candidate,Party,Type,Date,Title,Speech
Lindsey Graham,R,p,"August 4, 2015",Press Release - Sharyl Attkisson: Fact Check: The Washington Post on Senator Graham's Military Service,"Alexandria, VA  Yesterday, former CBS News investigative journalist Sharyl Attkisson fact-checked the The Washington Post's story on Senator Graham. In case you missed it, read the full article here and take a look at some of her findings below:""There's nothing wrong with examining a public official's service record or searching for mischief among his service files. The mistake can come if the investigation doesn't deliver on the starting theory and the reporter fails to either drop the story or change the premise to reflect the actual revelations.""In this instance, the Post obtained Graham's records through a Freedom of Information Act request and, instead of unearthing a scandal, found glowing evaluations.""""The Washington Post published a lengthy article in which the premise appears to be that Republican presidential candidate Sen. Lindsey Graham of South Carolina, a recently retired Colonel in the Air Force Reserve, is a military lightweight who never did much real service, didn't deserve his promotions, received favor for his congressional position and traded politically on a dishonestly exaggerated service record in which he purposefully misled.""There are countless ways to write a given story. The questions here are: 1. Are the Post's facts correct? and 2. Are the story's implications true and accurate?""...""Sen. Lindsey Graham's Tours of Duty in Iraq & Afghanistan as Air Force Reservist and Member of CongressAfghanistan:May 24-25, 2015Dec 27, 2014 - Jan 3, 2015June 28 - July 3, 2014Dec 28, 2013 - Jan 2, 2014Jul 4-9, 2013Jan 18-24, 2013Aug 17-23, 2012Mar 31 - Apr 6, 2012Aug 25-30, 2011May 30 - June 5, 2011Jan 17-25, 2011Aug 7-18, 2010Apr 2-10, 2010Aug 19-27, 2009Dec 7-12, 2008Iraq:Feb 11-20, 2008Aug 13-24, 2007Apr 2-9, 2007Aug 13-17, 2006""One might think that any story about a current presidential candidate's alleged exaggeration or dishonesty of battle-like experience would warrant at least a mention of perhaps the oddest and most blatant case of all: that of Hillary Clinton, the Democrats' frontrunner. While running for office in 2008, Clinton incorrectly and repeatedly claimed she faced ""sniper fire"" on a trip to Bosnia in 1996. She stuck by the false story even after we aired CBS News video showing that no such thing had happened.""However, the Post did not deem the Clinton case relevant to its dissection of Republican Sen. Lindsey Graham's military service.""...""1. The Post article's thesis statement was: '...a detailed examination of Graham's military record  much of it obtained under the Freedom of Information Act  shows that the Air Force afforded him special treatment as a lawmaker, granting him the privileges of rank with few expectations in return.'""The implication seems to be that something ominous and perhaps untoward happened.""Instead, one could have written: '...a detailed examination of Graham's military record shows that Graham was well-regarded by superiors who gave him glowing evaluations, ranked him in the 'top 1 percent of his peer group,' said that Graham's 'mastery of criminal law evidence is proven in trial after trial,' and once stated that Graham's cross-examination of a murder suspect as 'made Perry Mason look like a beginner'.'""2. The Post article stated: 'In the Republican presidential contest, Graham is trading on his reputation as a foreign-policy expert.'""The implication appears to be that Graham may be improperly exploiting his foreign policy expertise for political gain.""Instead, one could have written: 'In the presidential contest, Graham has the most extensive resume among Democrats and Republicans when it comes to foreign policy experience, military service as an officer and attorney, and assignments in hostile territory while a sitting member of Congress.'""3. The Post article stated: 'In 2003, the Air Force assigned Graham to a new job: as a judge on its Court of Criminal Appeals. His workload would be unexpectedly light.'""The implication seems to be that Graham was assigned a sham job, with no real duties, as some sort of favor or privilege. However, that does not appear to be the case.""Instead, one could have written: 'In 2003, the Air Force assigned Graham to a new job: as a judge on its Court of Criminal Appeals. But an airman convicted of drug use successfully challenged Graham's unique status as both a judge and a sitting member of the Congress, forcing Graham off the Court. Graham pushed for, and received, a new assignment.'""4. The Post article stated: 'Next, Graham was reassigned as a senior instructor at the Judge Advocate General's School in Alabama. His personnel file states that his duties for the next three years were to provide 'basic and advanced instruction in military legal practice to attorneys and paralegals.' But there is no evidence that he ever did.'""The implication appears to be that Graham shirked his duty and misled when he listed the job title on his biography. However, it turns out Graham had opted, voluntarily, for a much riskier assignment that would take him to Iraq and Afghanistan.""Therefore, one could have written: 'Next, Graham was assigned a stateside job as a senior instructor at the Judge Advocate General's School in Alabama. But he forewent the teaching position to push for a more dangerous assignment in the Mideast: helping a task force oversee policy on detention of military prisoners.'""5. The Post article stated: 'Graham buttonholed senior commanders and persuaded the Pentagon to grant him waivers to its policy' of prohibiting legislator-reservists from war zone assignments.""The use of the term 'buttonhole' connotes a confrontational and possibly improper approach Graham used to garner an improper favor of some sort.""Instead, one could have written: 'Normally, policy prohibits legislator-reservists from serving in 'imminent danger areas,' but Graham felt the contribution he could make in the riskier overseas assignment was so valuable, he successfully used his power of persuasion to convince the Pentagon to allow it.'""6. The Post article stated: 'The Air Force agreed to let him deploy for unusually brief tours  between two days and two weeks  when it suited his schedule. He would travel to Iraq or Afghanistan with a congressional delegation, then stay to perform his military service.'""The implication seems to be that Graham shirked his duty, was granted inappropriate favors, and acted at his own convenience rather than in the interest of the military or the public.""Instead, one could have written: 'Sen. Graham successfully balanced his demanding senate schedule and his military tours by deploying for up to two weeks at a time, often during congressional breaks and vacations. He frequently saved time and taxpayer dollars by traveling to Iraq or Afghanistan with a congressional delegation, then staying on to perform his military service.'""...""There's nothing wrong with examining a public official's service record or searching for mischief among his service files. The mistake can come if the investigation doesn't deliver on the starting theory and the reporter fails to either drop the story or change the premise to reflect the actual revelations.""In this instance, the Post obtained Graham's records through a Freedom of Information Act request and, instead of unearthing a scandal, found glowing evaluations. The matter from his files that they portrayed as the most damagingthat Graham held a stateside teaching title but did not teachwas not quite the blemish that the Post implied. A careful reading reveals that the reason Graham did not teach is because he opted for a more dangerous assignment: overseas duty in Iraq and Afghanistan working on detainee policy in the wake of the Abu Gharib detainee scandal. Instead of a case of a politician allegedly avoiding danger and taking the easy way out, this appears to be the reverse: Graham voluntarily putting himself closer to harm's way as part of his military service.""...Read Full Story Here"
Lindsey Graham,R,p,"August 4, 2015","Press Release - Seacoast Online: Graham: ""I Can Reset a World Falling Apart""","Graham: ""I can reset a world falling apart""By Erik HawkinsAugust 3, 2015PORTSMOUTH - Lindsey Graham is running for the Republican presidential nomination, and he is making no bones his almost laser-like focus on national security....At a Monday editorial board meeting at Seacoast Media Group, the senator offered some of his positions and took questions from editors and staffers in a wide-ranging conversation. Graham sees the defeat of ISIL and radical Islam as well as the stabilization of the Middle East as fundamental elements not only of a safer, but more prosperous nation, connecting national security to the economy, energy independence and even the plight of debt-burdened college graduates.""I've learned from my mistakes, Bush's mistakes and Obama's mistakes and I believe I have a foreign policy that will be appealing to the American public,"" Graham said. ""I think that I can reset a world that's falling apart.""Graham said he believes that if the National Security Agency's metadata program had been in place years ago, there never would have been a September 11, 2001, attack on the United States, and that its data collection is merely putting together algorithms rather than eying the content of citizens' phone calls and texts. Graham also considers NSA leaker Edward Snowden more of a traitor than a patriot. ""Not in my book (is he a hero). He compromised lives,"" he said.""I don't want to listen to your phone calls. There are people already here that are planning the next attack on our country,"" he added.To put a stop to ISIL and stabilize the Middle East, Graham believes an additional 3,500 ground troops will be needed to train local forces in the region and that Special Forces operations need to be mobilized to take out terrorist leadership. ""I'm about security through strength, not peace through strength,"" he said, noting that the enemies our country faces now are not ""rational actors,"" as the Soviet Union was during the Cold War.""This is a generational struggle,"" he said. ""This is a religious war for the heart of Islam, even though most of them want to live in peace ... the outcome matters to us. This isn't a battle for the heart and soul of Vietnam or Korean Peninsula ... If you don't think they're going to try and hit us again, you're not listening ... ignoring them leads to a world in complete chaos.""...Graham praised the New Hampshire primary process, one that makes him believe his campaign will succeed given the crowded GOP field.""A lot of these candidates are running on name recognition, but it's about content and character here in New Hampshire,"" he said.""When you have to offer solutions it changes. It's a very informed electorate here in New Hampshire.""I'm going to work my butt off,"" he said. ""That's what I've been doing over the years to understand the world ... All I can say is, thank God for New Hampshire.""Read Full Story Here"
Lindsey Graham,R,p,"August 6, 2015","Press Release - Make No Mistake, Graham Is Ready To Be Commander In Chief On Day One","Make No Mistake, Graham Is Ready To Be Commander In Chief On Day One National Journal: ""When It Comes To Foreign Policy Credentials, He's Got His Competitors Beat.""(Marina Koren, ""Lindsey Graham on ISIS, Putin, and Being a 'Threat-Mongerer,'"" National Journal, 07/08/15)Des Moines Register:""Widely Respected For His Principles And His Foreign Policy Acumen.""(Editorial Board, ""Editorial: Among Senators Hoping To Be President, Graham Deserves A Look,"" Des Moines Register, 05/06/15)TIME:""Graham Stands Relatively Alone In Clearly Presenting A Foreign Policy Vision.""(Zeke Miller,""Lindsey Graham Forces Foreign Policy on 2016 GOP Field,""TIME,01/29/15) ""An Unparalleled Depth Of Experience On Foreign Policy""""Colleagues say he's got an unparalleled depth of experience on foreign policy, especially compared to hiscompetitors in the Senate, who have had less time in the upper chamber to build their foreign policycredentials...Besides former Republican presidential nominee John McCain, there are few in theRepublican Party who are as widely recognized for their hawkish foreign policy as Graham."" (Lauren Fox,""Lindsey Graham's Presidential Campaign Has a Point,"" National Journal, 06/01/15)Ira Straus In National Review:""Graham Has The Character To Carry Through On A Policy Of Victory In The War."" ""America is fortunate that it finally has such a candidate in Lindsey Graham. This is a welcome piece of good news, after six years of increasingly disastrous foreign-policy blunders...Indeed, of all the myriad candidates running today, he is the only reliable choice for America."" (Ira Straus, ""Why America Needs Lindsey Graham,"" National Review, 06/02/15) Wall Street Journal:""He's Had Vladmir Putin'sNumberSince The Bush Administration"" ""He saw early how Mr. Obama's abdications in Syria and Iraq would lead to greater disorder, and he's had Vladimir Putin's number since the Bush Administration."" (Editorial Board, ""Graham for the Defense,"" The Wall Street Journal, 06/03/15)Former New Hampshire Republican National Committeeman Tom Rath: ""His Foreign Policy Chops Will Not Go Unnoticed In This Field"" (John DiStaso, ""NH Seen As Crucial To Lindsey Graham's Presidential Hopes,"" WMUR, 06/01/15)Sen. Joe Lieberman: ""There Is No One Who Knows And Understands National Security Questions Better Than Lindsey"" ""He should be taken very seriously because there is no one who knows and understands national security questions better than Lindsey,' said former Sen. Joe Lieberman, who worked with Graham when he was in the Senate on everything from foreign policy to climate change."" (Lauren Fox,""Lindsey Graham's Presidential Campaign Has a Point,"" National Journal, 06/01/15) ABC NEWS: ""South Carolina Sen. Lindsey Graham Is 'Ready To Be Commander-In-Chief On Day One,' The Republican Said, Announcing His Presidential Bid From His Hometown Today."" (Erin Dooley, ""Lindsey Graham Jumps Into 2016 Presidential Race: Ready to Be Commander-in-Chief on Day One,' ABC News, 06/01/15)"
Lindsey Graham,R,p,"August 6, 2015",Press Release - Lindsey Graham's Agenda on Achieving Energy Independence,"Build the Keystone Pipeline. Lindsey Graham was one of the first senators to visit the oil sands and understands the benefits to our economy from this vitally important project, which would deliver oil from Canada  a close ally and key trading partner  as well as from North Dakota, to U.S. refineries and consumers. It has faced endless delays from the Obama Administration. Expanding our energy infrastructure creates jobs for American workers, spurs greater economic growth and development here at home, and keeps our access to reliable energy secure.Pursue ""All of the Above Approach"" to Energy Production. We should not rule out any safe, reliable source of energy from domestic and trusted sources. We need to ensure we can gain access to vast, untapped onshore and offshore sources of oil and natural gas, including through hydraulic fracturing, in a safe and affordable way. Expanding nuclear energy, including the construction and operation of new reactors, must once again become a priority.Reduce Dependence on Dangerous Regimes. Energy security is national security. Relying on energy from regimes that are hostile to our nation and our values leaves us vulnerable. It also poses a threat to military strength and military readiness. We need to boost domestic production and invest in the infrastructure and technology that will allow us to become fully energy independent.Support Cost-Effective Renewable and Sustainable Forms of Energy. American innovation and ingenuity are the key to the future of our energy production. Harnessing the power of solar, wind, and water in a cost-effective way will provide essential sources of energy with less waste and pollution. Investing in cutting-edge technologies and discovering what lies ahead at the frontiers of science are also important steps toward true energy independence.Mitigate Environmental Damage and Promote Conservation. We must adopt economically sound principles for reducing negative impacts on the environment and becoming better stewards of God's creation. This can be achieved through greater efficiency, less waste, better use of technology, and more cost-effective measures. All of these efforts will contribute both to a cleaner environment and greater energy resources."
Lindsey Graham,R,p,"August 6, 2015","Press Release - Campaign Statement in Response to Tonight's Fox News ""Happy Hour"" Debate","Alexandria, VA  In response to Senator Graham's performance in this evening's FOX News ""Happy Hour"" debate, campaign manager Christian Ferry today released the following statement:""Senator Lindsey Graham was the clear winner in today's 'happy hour' debate. He is ready to be Commander-in-Chief on day one.""He is ready to give the American people an honest plan for how we protect our homeland  defeat them over there before they come here. If a candidate for president does not understand that we must put American troops on the ground in Iraq and Syria, as part of a regional coalition, you are not ready to be Commander-in-Chief. Lindsey Graham is.""He clearly articulated how we defeat radical Islam: whatever it takes, as long as it takes, until we defeat them. No one else on the stage has spent more time in the region understanding the challenges we face and planning the right solutions.""He is also the candidate ready to take on Hillary Clinton. Better than anyone else on the stage, he knows how to define the failures of the Obama Administration and the role Secretary Clinton played in creating and executing its feckless foreign policy than anyone.""If you want to put radical Islam in a box and nail it shut, if you want to defeat ISIL, if you want to restore the American Dream and reverse the onerous regulations that are stifling out the economy, Lindsey Graham is the only choice. The only one ready to lead."""
Lindsey Graham,R,p,"August 11, 2015",Press Release - Graham 2016 Releases South Carolina National Security Coalition,"Columbia, SC  At a press conference today, Senator Lindsey Graham announced the South Carolina National Security Coalition for his presidential campaign.The coalition is comprised of retired flag officers, former prisoners of war, current and former adjutants general of the South Carolina National Guard, officers who served with Graham during his 33 year military career, and civilians who have devoted their lives to honoring and serving our veterans. The group will assist the campaign by spreading the Senator's strong national security record to voters in South Carolina, communicating directly with veterans and military families, and explaining why Senator Graham is ready to be Commander-in-Chief on day one.In addition, Senator Graham returned to the state yesterday where he held campaign events and a""No Nukes for Iran""town hall meeting to continue to address the bad deal with Iran and our nation's security.""We live in dangerous times and Senator Graham is willing to tell the truth about what it's going to take to defend America when few others will.""said Bob Livingston,South Carolina Adjutant General.""He's an advocate for our men and women in uniform as well as our veterans.""Please find the list of Lindsey Graham 2016's South Carolina National Security Coalition below:Colonel Scott Cain,South Carolina Air National Guard (Retired)Bill Dukes,Founder of Honor Flight South CarolinaMajor General Lester D. Eisner,United States Army (Retired)William H. Funchess,Former 1st Lieutenant in United States Army, Korean War POWMajor General George Goldsmith,United States Army (Retired)Major General William ""Dutch"" Holland,United States Air Force (Retired)Brigadier General H.G. ""Butch"" Kirven,South Carolina Army National Guard (Retired)Major General Nelson Lacy,South Carolina State Guard (Retired)Honorable Robert E. Livingston, Jr.,South Carolina Adjutant GeneralColonel David B. Lobb,United States Army (Retired)General T. Michael Moseley,United States Air Force (Retired)Vice Admiral Charles L. Munns,United States Navy (Retired)Brigadier General Grady L. Patterson, III,South Carolina Air National Guard (Retired)Colonel Edwin Rumsey,United States Air Force (Retired)Rear Admiral Dean Sackett, Jr.,United States Navy (Retired)Colonel Pete Sercer,United States Air Force (Retired)Rear Admiral David K. Shimp,South Carolina Naval Militia (Retired)Major General Steve Siegfried,United States Army (Retired)Major General Stanhope S. Spears,United States Army (Retired), Former South Carolina Adjutant GeneralColonel Jack Van Loan,United States Air Force (Retired), Vietnam War POWLieutenant Colonel Thomas D. Von Kaenel,United States Army (Retired)Lieutenant General Claudius E. ""Bud"" Watts, III,United States Air Force (Retired), Former President of The CitadelBrigadier General Mitchell Willoughby,South Carolina Army National Guard (Retired)Brigadier General Mick Zais,United States Army (Retired), Former South Carolina Superintendent of Education"
