Candidate,Party,Type,Date,Title,SpeechMike Huckabee,R,p,"January 12, 2008",b'Press Release - Mike Huckabee Wins IUPAT Membership Poll On Republican Candidates While Campaigning In Michigan',"b'Little Rock, AR - On Saturday, January 12, 2008, the International Union of Painters and Allied Trades (IUPAT) formally announced that former Arkansas Governor and Republican Presidential Candidate Mike Huckabee won the majority of Republican candidate votes in a recent membership poll on who the union should support in the presidential race. ""I am tremendously honored to receive this historic support from the International Union of Painters and Allied Trades,"" said Huckabee while campaigning in Michigan. ""I appreciate this endorsement from the working men and women of the union - and pledge to keep their interests at the forefront of my economic policy."" ""We are fully aware that the membership of this union is both Republican and Democrat and this leadership wants to make certain both sides of the aisle are represented,"" said IUPAT General President James Williams. Earlier this year, Huckabee received another historic co-endorsement from The International Association of Machinists and Aerospace Workers - the first time IAM has supported a Republican presidential candidate in 119 years. ""This is yet another encouraging sign that my pro-growth message of opportunity and prosperity for all Americans is resonating,"" said Huckabee, who spoke yesterday at the Detroit Economic Club about his views on jobs, globalization, healthcare and the other domestic and foreign policy issues. The IUPAT announcement is the result of an unprecedented special ballot that was sent to 160,000 IUPAT members and retirees across the United States last December. Included with the ballot were letters written by the candidates - Republican and Democrat - specifically to IUPAT members as to why he or she is the best candidate for the top job in the United States. The ballot also included comprehensive fact sheets on the candidates\' voting records on the issues important to America\'s working families. ""Governor Huckabee\'s frank talk on the campaign trail has impressed our conservative members and we, as a union, look forward to an ongoing dialogue with him as he makes his case to be our next president. It\'s our hope to be a strong influence in making certain his campaign considers the needs of working families in this country. His openness and candor thus far shows that he is a leader willing to consider all points of view,"" Williams said. The International Union of Painters and Allied Trades represents over 160,000 working and retired men and women of the finishing trades in the United States (www.IUPAT.org). The IUPAT is renowned for its political activism within the organized labor movement and has been dubbed the Army of Black and Gold because of its members\' signature black and gold t-shirts and large numbers at rallies.'"
Mike Huckabee,R,p,"January 12, 2008",b'Press Release - Right To Life Of Montana PAC Endorses Mike Huckabee',"b'LITTLE ROCK, AR -- The Right to Life of Montana Political Action Committee has endorsed former Arkansas Governor Mike Huckabee in the race for President of the United States. ""Governor Huckabee\'s stance on the sanctity of life has always been clear and consistent, without wavering. No candidate has a stronger record on the sanctity of life than Mike Huckabee,"" said State Chairman Steve Daines. Right to Life of Montana is an organization that believes that all life is fragile and that life is the ""first inalienable right."" The group was founded more than 30 years ago to protect the elderly, the handicapped and the unborn. RTLM is the official state affiliate of the National Right to Life Committee. It is an organization that uses legislation and educational programs to help Montana citizens become aware of the truths behind the abortion industry. It represents 40,000 pro-life households in Montana. ""We\'re proud to announce our endorsement of Governor Huckabee,"" said RTLM Executive Director Gregg Trude. ""Mike Huckabee has been a leader in upholding the value of human life. As our next President, Mike Huckabee will support the passage of a constitutional amendment to protect the right to life. He will also appoint judges that will support overturning Roe v. Wade."" RTLM noted Huckabee\'s record as governor of Arkansas in the endorsement. As governor, he helped pass parental notification, an informed consent law, a bill requiring that a woman be told her baby will experience pain during an abortion and offer anesthesia for her baby and a bill to make it a crime for an unborn baby to be injured or murdered during an attack on its mother. ""That\'s why Right to Life of Montana urges strong support for Mike Huckabee,"" Trude said'"
Mike Huckabee,R,p,"January 14, 2008",b'Press Release - Leading Social Conservative In Florida Switches From Thompson To Huckabee',"b'Little Rock, AR John Stemberger, a leading voice in the conservative movement of Florida has switched his personal endorsement in the race for the Republican presidential nomination from former U.S. Senator Fred Thompson to former Arkansas Governor Mike Huckabee. Stemberger will be co-chairing the Mike Huckabee Faith and Family Values Coalition for Florida, it was announced today after he informed the Thompson campaign of his decision. ""Governor Huckabee is without question the best candidate to breathe new life and fresh hope into a nation and its people who are fed up with scandal, corruption and big-money power politics. Mike Huckabee is a proven leader with executive experience and a solid record as a champion for pro-life and pro-family values, Stemberger said. ""As a result, he has won the trust of more social conservative leaders across America than any other candidate. He has also proven that he is a viable candidate who can take us all the way home by winning both the primary and the general elections."" Stemberger is the founder of the Institute for Conservative Studies at Florida State University and has been one of the leading pro-life, pro-family advocates in Florida over the past 25 years. He was a lobbyist for Florida Right to Life and served as the Political Director for the Republican Party of Florida during the final campaign of former President George H.W. Bush. ""Like Ronald Reagan before him, Mike Huckabee can restore common sense conservative leadership to America both at home and abroad,"" Stemberger said. ""He will re-envision us to once again become \'one nation, under God\' while ensuring ""liberty and justice for all.\'"" Stemberger is a member of the Council for National Policy, the Arlington Group in Washington, D.C., and serves as the state chairman of Florida Marriage.org, the official sponsoring committee for the Florida Marriage Protection Amendment. ""John is a strong voice in the pro-life community. I welcome John\'s support and help in getting out my message that I have been a consistent voice for the right to life,"" Governor Huckabee said.'"
Mike Huckabee,R,p,"January 14, 2008",b'Press Release - Outdoorsman Icon Ray Scott Endorses Mike Huckabee for President',"b'Little Rock, AR  Former Arkansas Governor and Presidential Candidate Mike Huckabee has received the endorsement of ""America\'s Outdoor Icon"" Ray Scott. Scott founded the Bass Anglers Sportsman Society (BASS) in 1968 which became the world\'s largest fishing organization with over 500,000 members. The company was bought in 2001 by ESPN. He is also the founder of the Whitetail Institute of North America. ""I am pleased to have received the endorsement of Ray Scott  a legendary outdoorsman and conservationist. We share a passion for the outdoors and I was proud to be honored along with him recently in Outdoor Life as one of 25 individuals who\'ve had the greatest positive impact on hunting and fishing. ""Ray has worked hard to ensure that Americans continue to enjoy their outdoor pastimes. Even more he has helped them understand their responsibility to protect and preserve their outdoor resources and to recognize their power to improve them. Not just for themselves but for future generations."" Affectionately known as the ""Bass Boss,"" Scott\'s BASS organization changed the face of sport fishing forever with his creation of Bassmaster Magazine, professionally run fishing tournaments including the Bassmaster Classic, bass fishing TV shows, and affiliated BASS clubs which became his highly effective grassroots conservation ""minutemen."" ""I am really pumped about Huckabee\'s candidacy,"" says Scott. I\'ve never been a one-issue voter and I won\'t start now, but it\'s sure exciting to have an authentic angler and hunter as a candidate. I was thrilled to fid out he\'s been a life member of BASS since 1996. Even more important, I\'m inspired by his message of hope and prosperity and strength. Like a friend of mine said, he\'s the \'real deal\' and I think more and more people are seeing that. ""I look forward to doing my part to see to it that Mike Huckabee becomes the next President of the United States.""'"
Mike Huckabee,R,p,"January 15, 2008","b'Press Release - Baseball Legend and Sumter, SC Native Bobby Richardson Goes to Bat for Mike Huckabee'","b'Baseball Legend and Sumter, SC Native Bobby Richardson Goes to Bat for Mike Huckabee Richardson Says Huckabee is Number 1 for President Columbia, SC  Baseball Legend and Sumter, SC native Bobby Richardson endorsed Mike Huckabee for President at a campaign rally at the Black River Electric Co-operative in Sumter, South Carolina today. Richardson stated, ""As someone who always wore the number 1 on my jersey, I am here to let everyone know that Mike Huckabee is truly Number 1. I hope voters all across South Carolina hit a homerun on January 19th by voting for Mike Huckabee in the South Carolina Republican Primary."" Huckabee stated, ""I am excited to have Bobby Richardson on my team and appreciate his support. As a lifelong baseball fan, I am truly proud to have the support of various baseball greats including Bob Feller and Bobby Richardson and urge all baseball fans and voters alike to join Bobby Richardson in voting on Saturday, January 19th."" Richardson, a seven-time All-Star and the 1960 World Series MVP won five Gold Gloves and three World Series rings while starring at Second Base for the New York Yankees. After hanging up his glove in 1966, Richardson coached baseball teams at Liberty University, Coastal Carolina University, and the University of South Carolina, where he led the Gamecocks to their first ever College World Series in 1975. Richardson is also a highly sought-after motivational speaker, is a national leader within the Fellowship for Christian Athletes and was a 1976 Republican nominee for Congress.'"
Mike Huckabee,R,p,"January 16, 2008","b'Press Release - Former Governor and Presidential Candidate Mike Huckabee Signs ""No Amnesty"" Pledge'","b'Tigerville, SC  While visiting North Greenville University today, former Arkansas Governor and Presidential candidate, Mike Huckabee became the first presidential candidate to sign a ""no amnesty"" pledge. He was joined at the event by Roy Beck, President of Americans for Better Immigration. ""I think it\'s important to be very clear,"" said Huckabee. ""There should be no doubt about my Secure America Plan: our plan is not an amnesty or a sanctuary city plan but a proper plan for the rule of law. We will secure our borders and build the fence within 18 months."" Following is the pledge signed: ""I pledge to oppose amnesty or any other special path to citizenship for the millions of foreign nationals unlawfully present in the United States . As President, I will fully implement enforcement measures that, over time, will lead to the attrition of our illegal immigrant population. I also pledge to make security of our borders a top priority of my administration.""'"
Mike Huckabee,R,p,"January 16, 2008",b'Press Release - Arkansas Businessmen for Mike Huckabee Respond To Club For Growth Ad',"b'Columbia, SC - The following group of Arkansas businessmen supporting Presidential Candidate Mike Huckabee held a news conference today to respond to negative attacks from the Club for Growth against Huckabee. Lu Hardin- President of University of Central Arkansas and Former Director of Higher Education; Bill Schwyhart- Former Wal-Mart Executive and current member Pinnacle Group Partner; Curtis Coleman - President/CEO Safe Foods Corp.; French Hill, President Delta Bank and Trust; Gilbert Baker- State Senator and Past Party Chairman; Doug Matayo - Former State Representative and Governor Huckabee\'s House Leader; David Haak - Former State Representative and Small Business Owner The group released a list detailing the supporters of presidential candidate, Mitt Romney who have been financing a negative ad campaign against Huckabee.Question: What does $585,000 buy you? Answer: It bought Mitt Romney backers a smear job against Mike Huckabee orchestrated by Beltway Insiders.The Club for Growth has an affiliated 527 group, Club for Growth.net, running anti-Mike Huckabee ads in early primary states. - At least $585,000 in contributions from Mitt Romney financial backers. - Club for Growth has spent $750,000 against Governor Huckabee in Iowa, South Carolina and Michigan. Here are donors that have donated both to Club for Growth.net* and Mitt Romney:Name Contribution to Beltway Group Contribution to Mitt RomneyJohn Childs** $100,000 on 11/16/07 $2,100 on 1/8/07$100,000 on 12/31/07 Bob Perry $200,000 on 12/12/07 $2,300 on 3/13/07Kristen Hertel $25,000 on 12/21/07 $1,000 on 2/6/07 $25,000 on 1/02/08Muneer Satter $25,000 on 12/21/07 $2,300 on 2/6/07 $25,000 on 1/02/08Michael Valentine $40,000 on 1/3/08 $2,300 on 4/4/07Travis Anderson $25,000 on 12/19/07 $2,100 on 2/8/07Richard Gaby $20,000 on 12/19/07 $1,000 on 2/12/07* Only represents donors that contributed more than $20,000 to Club for Growth.net in 2007/2008.** ""Boston investor John Childs, who donated $2,100 to Romney in 2007, recently gave 100,000 to the Club for Growth."" [Morain, Dan. ""Huckabee foes open their wallets for attack ads,"" The Los Angeles Times. 1 January 2008.] *** All contributor information obtained from Federal Election Commission\'s electronic database at www.fec.gov.'"
Mike Huckabee,R,p,"January 16, 2008","b'Press Release - Arkansas Businessmen Release Statement Supporting Former Governor and Presidential Candidate, Mike Huckabee'","b'Columbia, SC - Today, the following businessmen from Arkansas released a statement in support of former Arkansas Governor, Mike Huckabee: Scott T. Ford, President and CEO, Alltel Corporation; Warren A. Stephens, President and CEO, Stephens Inc.; Madison Murphy, Former Chairman, Murphy Oil Corporation; John Tyson, Chairman of the Board, Tyson Foods, Inc; and French Hill, Chairman and CEO, Delta Trust and Banking Corporation: ""We are a traditionally bi-partisan group of executives of several of the largest corporations headquartered in the State of Arkansas, each with considerable exposure to the Administration of Governor Mike Huckabee. Of late, Governor Huckabee has attracted what we believe to be unwarranted criticism regarding his business record."" ""Our experience with Governor Huckabee indicates that he not only values greatly the freedoms of religion and liberty, but of the free market as well. He is an atypical leader who garnered the respect of not only the professional business community but of the working men and women across our State as well."" ""When he became our Governor, he inherited our long sub-standard education system, infrastructure, and regulatory climate. Under his leadership, we were able to grow our businesses, increase our employment, reduce our litigation exposure and enjoy, along with all of our fellow Arkansans, a healthier economy, improved schools, updated highways, and new healthcare delivery facilities."" ""In our support of Governor Huckabee\'s truly conservative, small government business outlook and his pragmatic, yet compassionate style of governing, we invite you to look past the shallow rhetoric of yet another campaign season to see what we have experienced first hand - that with the right political leadership in place, businesses and citizens can jointly prosper and as they do, they contribute so much more to the economic and societal fabric of a community than simply tax revenues.""'"
Mike Huckabee,R,p,"January 16, 2008",b'Press Release - Huckabee Campaign Denounces Push Polling Calls -- Again',"b'South Carolina, and any state in the country. ""As I\'ve said before, our campaign has nothing to do with push polling and I wish they would stop. We don\'t want this kind of campaigning because it violates the spirit of our campaign. I want to become President because I am the best candidate, not because I attacked the other candidate,"" said Huckabee from the campaign trail in South Carolina. National Campaign Manager Chip Saltsman agreed: ""Anyone who has the slightest understanding of the race ahead and the mindset of voters would know this sort of activity is extremely counterproductive. It takes the campaign off message at a time when Governor Huckabee is resonating with voters here in South Carolina."" ""We have enthusiastic, overflow crowds at each of our events. It loses votes rather than gains them. It\'s an underhanded way of doing business that is not welcomed by the campaign and it flies in the face of what Governor Huckabee stands for: integrity and clean politics. On behalf of Governor Huckabee and his campaign, I ask once again that these calls be stopped immediately,"" said Saltsman.'"
Mike Huckabee,R,p,"January 17, 2008",b'Press Release - South Carolina Lieutenant Governor Endorses Mike Huckabee for President',"b'Columbia, SC -- South Carolina Lieutenant Governor Andre Bauer endorsed Mike Huckabee for President, it was announced today. Bauer will join Huckabee as well as Former Governor David Beasley, State Chairman Mike Campbell , Chuck Norris, and Ric Flair on the campaign trail on Thursday. Bauer stated, ""I, like many voters, have been previously undecided, but this election is too important to sit on the sidelines. This week, I have decided to vote for Mike Huckabee, and I urge all South Carolinians to join me in voting for Mike Huckabee this Saturday. Simply put, I believe Mike Huckabee is the best of several fine candidates to lead America . As America faces tough times, Mike Huckabee has the character, integrity, and proven leadership to ensure our greatest days are yet to come."" ""Also, I\'ve tried to carefully compare each candidate\'s position as it relates to issues affecting senior citizens, and I\'ve concluded that Mike Huckabee is a sound choice for senior citizens,"" Bauer said. As Lt. Governor, Bauer heads the state\'s office on aging. Bauer also said he admires Huckabee\'s ability to win against the odds, noting that he, too, has a history of winning races considered to be upsets. ""Nobody knows better than I do that it\'s the people, not the polls, which determines the winner on election day,"" Bauer said. ""I believe the fact that Mike Huckabee has stayed positive while others have waged negative campaigns against him, will sway undecided voters toward him. I believe it speaks to his character."" Huckabee stated, ""I welcome Andre\'s support and am glad to have him on board Team Huckabee. I\'m really pleased to have the support of a leader with such a solid record of achievement and a reputation for hard work and being a servant of the people, who shares my commitment to conservative governance."" Bauer, who is serving his second term as South Carolina\'s Lieutenant Governor, has joined Mike Huckabee\'s leadership team in South Carolina, which already includes Former Governor David Beasley, United States Congressman Bob Inglis, State Chairman Mike Campbell and the family of Former Governor Carroll A. Campbell Jr., and numerous state legislators including Greenville State Senator David Thomas, Rex Rice, and Liston Barfield of Conway.'"
Mike Huckabee,R,p,"January 18, 2008",b'Press Release - Huckabee Campaign Manager Chip Saltsman Comments On Recent Remarks By Gov. Huckabee',"b'Columbia, SC  Huckabee for President Campaign Manager Chip Saltsman issued the following statement regarding a comment made by former Arkansas Governor Mike Huckabee on television this morning: ""The Constitution has been amended 27 times in 221 years. Included in those amendments are free speech, freedom of religion, emancipation of the slaves, and women\'s right to vote. Gov Huckabee supports amendments for marriage and human life. His comments today were directed toward his support for those two important amendments.""'"
Mike Huckabee,R,p,"January 18, 2008",b'Press Release - Mike Huckabee: South Carolina Needs Aggressive Broad Based Economic Renewal',"b'Former AR Governor Has Five-Point Plan to Stimulate Economy for Working Families Greenville, SC  The latest unemployment news from South Carolina shows how important ""aggressive action is to a broad-based economic renewal,"" Presidential Candidate Mike Huckabee said today. ""President Bush\'s plan will help, and it\'s an important step. But South Carolina and the rest of the nation need some bigger changes if we are to reverse the trends of the last few years,"" Governor Huckabee said today while campaigning through South Carolina in advance of tomorrow\'s Republican presidential primary. Last Monday, Governor Huckabee released his own five-point ""Fair Deal"" stimulus package aimed at creating jobs: 1) More income, better jobs, more secure home ownership for middle-class families, 2) work with the Federal Reserve for a pro-growth, low-inflation economy, 3) increase defense spending to 6 percent of Gross Domestic Product in response to real threats to America\'s security, 4) invest in energy independence and 5) move toward a Fair Tax that eliminates the current distorted tax code. The South Carolina unemployment rate jumped to 6.6 percent in December, up from 5.9 percent the previous month, according to the state Employment Security Commission. It was the largest one-month increase since at least 1990, state officials said. One major problem, Huckabee said, is the current unfair tax code. ""If we replace the IRS with the Fair Tax, we lift the burden off of the small- and medium-sized businesses who create most of the jobs. Then the only people who we then have to feel sorry for are the legions of Washington lobbyists who manipulate the current complicated code for somebody else,"" Huckabee said.'"
Mike Huckabee,R,p,"January 22, 2008",b'Press Release - Gov. Mike Huckabee Comments On Thompson News',"b'LITTLE ROCK, AR  Former Arkansas Governor and Presidential Candidate Mike Huckabee issued the following statement today: ""Today, Senator Fred Thompson announced that he will no longer seek the Republican nomination for President. I wish Fred the best. ""Fred\'s decision, along with my friend Congressman Duncan Hunter\'s departure from the race, narrows the presidential field. I want to thank these fine men for their contributions to the debate. Our Party, and our nation, depends upon the patriotism and dedication of men and women who get involved in the political process. ""I commend Fred and Duncan for their focus on America\'s role in the world. I share their absolute conviction that the first responsibility of government is to protect the American people. Our country must prevail in our fight against radical Islamics who want to destroy us. ""As a pro-life, pro-lower tax conservative Republican, who believes in the Second amendment, I believe that one of the greatest ongoing threats to our constitutional republic is the politicization of the federal judiciary. The role of a judge is to interpret the law, not to legislate from the bench; as president, I will only appoint men and women who share this view. ""As we move forward, I\'d like to ask Fred\'s supporters, and Duncan\'s, to join our campaign. As a true authentic conservative, I have a vision to bring hope, opportunity and prosperity to all Americans, and I welcome their support.""'"
Mike Huckabee,R,p,"January 22, 2008",b'Press Release - Statement By Gov. Mike Huckabee On Anniversary Of Roe vs. Wade Court Decision',"b'""Today is the 35th anniversary of a great American tragedy, the Roe vs. Wade court decision that has led to the loss of millions of innocent lives. These children were denied the right to life our Constitution grants to everyone in America, only because they had yet to emerge from their mother\'s womb. As President Bush noted today, America is better than this. ""I support and have always supported passage of a constitutional amendment to protect the right to life. As president, I will fight for passage of this amendment. My convictions regarding the sanctity of life have always been clear and consistent, without equivocation or wavering. I believe that Roe v. Wade should be over-turned. ""I applaud those who are marching in Washington and elsewhere to call attention yet again to this terrible injustice. I stand with them in calling for the passage of a Constitutional amendment to overturn Roe v. Wade and restore the constitutional rights of the unborn, and I will march with them next year if I am elected president. As president, I pledge that I will continue the fight so that every child can have his or her God-given right to life.""'"
